10:53:10.243519 IP felstaube.cs.sbg.ac.at.ssh > 192.168.0.16.49587: Flags [S.], seq 2689453270, ack 3470330947, win 64240, options [mss 1460,nop,nop,sackOK,nop,wscale 7], length 0
10:53:10.267786 IP felstaube.cs.sbg.ac.at.ssh > 192.168.0.16.49587: Flags [.], ack 22, win 502, length 0
10:53:10.274824 IP felstaube.cs.sbg.ac.at.ssh > 192.168.0.16.49587: Flags [P.], seq 1:42, ack 22, win 502, length 41
10:53:10.295328 IP felstaube.cs.sbg.ac.at.ssh > 192.168.0.16.49587: Flags [P.], seq 42:1122, ack 22, win 502, length 1080
10:53:10.341142 IP felstaube.cs.sbg.ac.at.ssh > 192.168.0.16.49587: Flags [.], ack 1414, win 501, length 0
10:53:10.362526 IP felstaube.cs.sbg.ac.at.ssh > 192.168.0.16.49587: Flags [.], ack 1462, win 501, length 0
10:53:10.369973 IP felstaube.cs.sbg.ac.at.ssh > 192.168.0.16.49587: Flags [P.], seq 1122:1574, ack 1462, win 501, length 452
10:53:10.433149 IP felstaube.cs.sbg.ac.at.ssh > 192.168.0.16.49587: Flags [.], ack 1478, win 501, length 0
10:53:10.459091 IP felstaube.cs.sbg.ac.at.ssh > 192.168.0.16.49587: Flags [.], ack 1522, win 501, length 0
10:53:10.459174 IP felstaube.cs.sbg.ac.at.ssh > 192.168.0.16.49587: Flags [P.], seq 1574:1618, ack 1522, win 501, length 44
10:53:10.492191 IP felstaube.cs.sbg.ac.at.ssh > 192.168.0.16.49587: Flags [P.], seq 1618:1670, ack 1590, win 501, length 52
10:53:10.561267 IP felstaube.cs.sbg.ac.at.ssh > 192.168.0.16.49587: Flags [.], ack 2242, win 501, length 0
10:53:10.581793 IP felstaube.cs.sbg.ac.at.ssh > 192.168.0.16.49587: Flags [P.], seq 1670:1698, ack 2242, win 501, length 28
10:53:10.606937 IP felstaube.cs.sbg.ac.at.ssh > 192.168.0.16.49587: Flags [.], ack 2354, win 501, length 0
10:53:10.712515 IP felstaube.cs.sbg.ac.at.ssh > 192.168.0.16.49587: Flags [P.], seq 1698:2346, ack 2354, win 501, length 648
10:53:10.732859 IP felstaube.cs.sbg.ac.at.ssh > 192.168.0.16.49587: Flags [P.], seq 2346:2390, ack 2354, win 501, length 44
10:53:10.754787 IP felstaube.cs.sbg.ac.at.ssh > 192.168.0.16.49587: Flags [.], ack 2474, win 501, length 0
10:53:10.755881 IP felstaube.cs.sbg.ac.at.ssh > 192.168.0.16.49587: Flags [P.], seq 2390:2462, ack 2474, win 501, length 72
10:53:10.792375 IP felstaube.cs.sbg.ac.at.ssh > 192.168.0.16.49587: Flags [P.], seq 2462:2514, ack 2510, win 501, length 52
10:53:10.837409 IP felstaube.cs.sbg.ac.at.ssh > 192.168.0.16.49587: Flags [.], seq 2514:3974, ack 2546, win 501, length 1460
10:53:10.837413 IP felstaube.cs.sbg.ac.at.ssh > 192.168.0.16.49587: Flags [.], seq 3974:5434, ack 2546, win 501, length 1460
10:53:10.837577 IP felstaube.cs.sbg.ac.at.ssh > 192.168.0.16.49587: Flags [.], seq 5434:6894, ack 2546, win 501, length 1460
10:53:10.837748 IP felstaube.cs.sbg.ac.at.ssh > 192.168.0.16.49587: Flags [.], seq 6894:8354, ack 2546, win 501, length 1460
10:53:10.837750 IP felstaube.cs.sbg.ac.at.ssh > 192.168.0.16.49587: Flags [.], seq 8354:9814, ack 2546, win 501, length 1460
10:53:10.837939 IP felstaube.cs.sbg.ac.at.ssh > 192.168.0.16.49587: Flags [.], seq 9814:11274, ack 2546, win 501, length 1460
10:53:10.838169 IP felstaube.cs.sbg.ac.at.ssh > 192.168.0.16.49587: Flags [.], seq 11274:12734, ack 2546, win 501, length 1460
10:53:10.838173 IP felstaube.cs.sbg.ac.at.ssh > 192.168.0.16.49587: Flags [.], seq 12734:14194, ack 2546, win 501, length 1460
10:53:10.838356 IP felstaube.cs.sbg.ac.at.ssh > 192.168.0.16.49587: Flags [.], seq 14194:15654, ack 2546, win 501, length 1460
10:53:10.838358 IP felstaube.cs.sbg.ac.at.ssh > 192.168.0.16.49587: Flags [.], seq 15654:17114, ack 2546, win 501, length 1460
10:53:10.859125 IP felstaube.cs.sbg.ac.at.ssh > 192.168.0.16.49587: Flags [.], seq 17114:18574, ack 2546, win 501, length 1460
10:53:10.859126 IP felstaube.cs.sbg.ac.at.ssh > 192.168.0.16.49587: Flags [.], seq 18574:20034, ack 2546, win 501, length 1460
10:53:10.859272 IP felstaube.cs.sbg.ac.at.ssh > 192.168.0.16.49587: Flags [.], seq 20034:21494, ack 2546, win 501, length 1460
10:53:10.860203 IP felstaube.cs.sbg.ac.at.ssh > 192.168.0.16.49587: Flags [.], seq 21494:22954, ack 2546, win 501, length 1460
10:53:10.860586 IP felstaube.cs.sbg.ac.at.ssh > 192.168.0.16.49587: Flags [.], seq 22954:24414, ack 2546, win 501, length 1460
10:53:10.860588 IP felstaube.cs.sbg.ac.at.ssh > 192.168.0.16.49587: Flags [.], seq 24414:25874, ack 2546, win 501, length 1460
10:53:10.862285 IP felstaube.cs.sbg.ac.at.ssh > 192.168.0.16.49587: Flags [.], seq 25874:27334, ack 2546, win 501, length 1460
10:53:10.862286 IP felstaube.cs.sbg.ac.at.ssh > 192.168.0.16.49587: Flags [.], seq 27334:28794, ack 2546, win 501, length 1460
10:53:10.862511 IP felstaube.cs.sbg.ac.at.ssh > 192.168.0.16.49587: Flags [.], seq 28794:30254, ack 2546, win 501, length 1460
10:53:10.862513 IP felstaube.cs.sbg.ac.at.ssh > 192.168.0.16.49587: Flags [.], seq 30254:31714, ack 2546, win 501, length 1460
10:53:10.862740 IP felstaube.cs.sbg.ac.at.ssh > 192.168.0.16.49587: Flags [.], seq 31714:33174, ack 2546, win 501, length 1460
10:53:10.862742 IP felstaube.cs.sbg.ac.at.ssh > 192.168.0.16.49587: Flags [.], seq 33174:34634, ack 2546, win 501, length 1460
10:53:10.864110 IP felstaube.cs.sbg.ac.at.ssh > 192.168.0.16.49587: Flags [.], seq 34634:36094, ack 2546, win 501, length 1460
10:53:10.864127 IP felstaube.cs.sbg.ac.at.ssh > 192.168.0.16.49587: Flags [.], seq 36094:37554, ack 2546, win 501, length 1460
10:53:10.864310 IP felstaube.cs.sbg.ac.at.ssh > 192.168.0.16.49587: Flags [.], seq 37554:39014, ack 2546, win 501, length 1460
10:53:10.865421 IP felstaube.cs.sbg.ac.at.ssh > 192.168.0.16.49587: Flags [.], seq 39014:40474, ack 2546, win 501, length 1460
10:53:10.865425 IP felstaube.cs.sbg.ac.at.ssh > 192.168.0.16.49587: Flags [.], seq 40474:41934, ack 2546, win 501, length 1460
10:53:10.865677 IP felstaube.cs.sbg.ac.at.ssh > 192.168.0.16.49587: Flags [.], seq 41934:43394, ack 2546, win 501, length 1460
10:53:10.865678 IP felstaube.cs.sbg.ac.at.ssh > 192.168.0.16.49587: Flags [.], seq 43394:44854, ack 2546, win 501, length 1460
10:53:10.865852 IP felstaube.cs.sbg.ac.at.ssh > 192.168.0.16.49587: Flags [.], seq 44854:46314, ack 2546, win 501, length 1460
10:53:10.878957 IP felstaube.cs.sbg.ac.at.ssh > 192.168.0.16.49587: Flags [.], seq 46314:47774, ack 2546, win 501, length 1460
10:53:10.878959 IP felstaube.cs.sbg.ac.at.ssh > 192.168.0.16.49587: Flags [.], seq 47774:49234, ack 2546, win 501, length 1460
10:53:10.879155 IP felstaube.cs.sbg.ac.at.ssh > 192.168.0.16.49587: Flags [.], seq 49234:50694, ack 2546, win 501, length 1460
10:53:10.879273 IP felstaube.cs.sbg.ac.at.ssh > 192.168.0.16.49587: Flags [.], seq 50694:52154, ack 2546, win 501, length 1460
10:53:10.879403 IP felstaube.cs.sbg.ac.at.ssh > 192.168.0.16.49587: Flags [.], seq 52154:53614, ack 2546, win 501, length 1460
10:53:10.879564 IP felstaube.cs.sbg.ac.at.ssh > 192.168.0.16.49587: Flags [.], seq 53614:55074, ack 2546, win 501, length 1460
10:53:10.879565 IP felstaube.cs.sbg.ac.at.ssh > 192.168.0.16.49587: Flags [.], seq 55074:56534, ack 2546, win 501, length 1460
10:53:10.879773 IP felstaube.cs.sbg.ac.at.ssh > 192.168.0.16.49587: Flags [.], seq 56534:57994, ack 2546, win 501, length 1460
10:53:10.879923 IP felstaube.cs.sbg.ac.at.ssh > 192.168.0.16.49587: Flags [.], seq 57994:59454, ack 2546, win 501, length 1460
10:53:10.879938 IP felstaube.cs.sbg.ac.at.ssh > 192.168.0.16.49587: Flags [.], seq 59454:60914, ack 2546, win 501, length 1460
10:53:10.880146 IP felstaube.cs.sbg.ac.at.ssh > 192.168.0.16.49587: Flags [.], seq 60914:62374, ack 2546, win 501, length 1460
10:53:10.880302 IP felstaube.cs.sbg.ac.at.ssh > 192.168.0.16.49587: Flags [.], seq 62374:63834, ack 2546, win 501, length 1460
10:53:10.880304 IP felstaube.cs.sbg.ac.at.ssh > 192.168.0.16.49587: Flags [.], seq 63834:65294, ack 2546, win 501, length 1460
10:53:10.880514 IP felstaube.cs.sbg.ac.at.ssh > 192.168.0.16.49587: Flags [.], seq 65294:66754, ack 2546, win 501, length 1460
10:53:10.880852 IP felstaube.cs.sbg.ac.at.ssh > 192.168.0.16.49587: Flags [P.], seq 66754:68194, ack 2546, win 501, length 1440
10:53:10.880853 IP felstaube.cs.sbg.ac.at.ssh > 192.168.0.16.49587: Flags [.], seq 68194:69654, ack 2546, win 501, length 1460
10:53:10.883804 IP felstaube.cs.sbg.ac.at.ssh > 192.168.0.16.49587: Flags [.], seq 69654:71114, ack 2546, win 501, length 1460
10:53:10.883808 IP felstaube.cs.sbg.ac.at.ssh > 192.168.0.16.49587: Flags [.], seq 71114:72574, ack 2546, win 501, length 1460
10:53:10.884153 IP felstaube.cs.sbg.ac.at.ssh > 192.168.0.16.49587: Flags [.], seq 72574:74034, ack 2546, win 501, length 1460
10:53:10.884721 IP felstaube.cs.sbg.ac.at.ssh > 192.168.0.16.49587: Flags [.], seq 74034:75494, ack 2546, win 501, length 1460
10:53:10.884722 IP felstaube.cs.sbg.ac.at.ssh > 192.168.0.16.49587: Flags [.], seq 75494:76954, ack 2546, win 501, length 1460
10:53:10.884971 IP felstaube.cs.sbg.ac.at.ssh > 192.168.0.16.49587: Flags [.], seq 76954:78414, ack 2546, win 501, length 1460
10:53:10.884986 IP felstaube.cs.sbg.ac.at.ssh > 192.168.0.16.49587: Flags [.], seq 78414:79874, ack 2546, win 501, length 1460
10:53:10.885168 IP felstaube.cs.sbg.ac.at.ssh > 192.168.0.16.49587: Flags [.], seq 79874:81334, ack 2546, win 501, length 1460
10:53:10.888231 IP felstaube.cs.sbg.ac.at.ssh > 192.168.0.16.49587: Flags [.], seq 81334:82794, ack 2546, win 501, length 1460
10:53:10.888235 IP felstaube.cs.sbg.ac.at.ssh > 192.168.0.16.49587: Flags [.], seq 82794:84254, ack 2546, win 501, length 1460
10:53:10.888564 IP felstaube.cs.sbg.ac.at.ssh > 192.168.0.16.49587: Flags [.], seq 84254:85714, ack 2546, win 501, length 1460
10:53:10.888568 IP felstaube.cs.sbg.ac.at.ssh > 192.168.0.16.49587: Flags [.], seq 85714:87174, ack 2546, win 501, length 1460
10:53:10.888698 IP felstaube.cs.sbg.ac.at.ssh > 192.168.0.16.49587: Flags [.], seq 87174:88634, ack 2546, win 501, length 1460
10:53:10.888839 IP felstaube.cs.sbg.ac.at.ssh > 192.168.0.16.49587: Flags [.], seq 88634:90094, ack 2546, win 501, length 1460
10:53:10.888952 IP felstaube.cs.sbg.ac.at.ssh > 192.168.0.16.49587: Flags [.], seq 90094:91554, ack 2546, win 501, length 1460
10:53:10.889915 IP felstaube.cs.sbg.ac.at.ssh > 192.168.0.16.49587: Flags [.], seq 91554:93014, ack 2546, win 501, length 1460
10:53:10.889930 IP felstaube.cs.sbg.ac.at.ssh > 192.168.0.16.49587: Flags [.], seq 93014:94474, ack 2546, win 501, length 1460
10:53:10.890108 IP felstaube.cs.sbg.ac.at.ssh > 192.168.0.16.49587: Flags [.], seq 94474:95934, ack 2546, win 501, length 1460
10:53:10.890112 IP felstaube.cs.sbg.ac.at.ssh > 192.168.0.16.49587: Flags [.], seq 95934:97394, ack 2546, win 501, length 1460
10:53:10.890341 IP felstaube.cs.sbg.ac.at.ssh > 192.168.0.16.49587: Flags [.], seq 97394:98854, ack 2546, win 501, length 1460
10:53:10.899127 IP felstaube.cs.sbg.ac.at.ssh > 192.168.0.16.49587: Flags [.], seq 98854:100314, ack 2546, win 501, length 1460
10:53:10.899128 IP felstaube.cs.sbg.ac.at.ssh > 192.168.0.16.49587: Flags [.], seq 100314:101774, ack 2546, win 501, length 1460
10:53:10.899326 IP felstaube.cs.sbg.ac.at.ssh > 192.168.0.16.49587: Flags [.], seq 101774:103234, ack 2546, win 501, length 1460
10:53:10.899327 IP felstaube.cs.sbg.ac.at.ssh > 192.168.0.16.49587: Flags [.], seq 103234:104694, ack 2546, win 501, length 1460
10:53:10.899614 IP felstaube.cs.sbg.ac.at.ssh > 192.168.0.16.49587: Flags [.], seq 104694:106154, ack 2546, win 501, length 1460
10:53:10.899615 IP felstaube.cs.sbg.ac.at.ssh > 192.168.0.16.49587: Flags [.], seq 106154:107614, ack 2546, win 501, length 1460
10:53:10.899829 IP felstaube.cs.sbg.ac.at.ssh > 192.168.0.16.49587: Flags [.], seq 107614:109074, ack 2546, win 501, length 1460
10:53:10.900387 IP felstaube.cs.sbg.ac.at.ssh > 192.168.0.16.49587: Flags [.], seq 109074:110534, ack 2546, win 501, length 1460
10:53:10.900390 IP felstaube.cs.sbg.ac.at.ssh > 192.168.0.16.49587: Flags [.], seq 110534:111994, ack 2546, win 501, length 1460
10:53:10.900636 IP felstaube.cs.sbg.ac.at.ssh > 192.168.0.16.49587: Flags [.], seq 111994:113454, ack 2546, win 501, length 1460
10:53:10.900637 IP felstaube.cs.sbg.ac.at.ssh > 192.168.0.16.49587: Flags [.], seq 113454:114914, ack 2546, win 501, length 1460
10:53:10.900871 IP felstaube.cs.sbg.ac.at.ssh > 192.168.0.16.49587: Flags [.], seq 114914:116374, ack 2546, win 501, length 1460
10:53:10.900872 IP felstaube.cs.sbg.ac.at.ssh > 192.168.0.16.49587: Flags [.], seq 116374:117834, ack 2546, win 501, length 1460
10:53:10.901170 IP felstaube.cs.sbg.ac.at.ssh > 192.168.0.16.49587: Flags [.], seq 117834:119294, ack 2546, win 501, length 1460
10:53:10.901173 IP felstaube.cs.sbg.ac.at.ssh > 192.168.0.16.49587: Flags [.], seq 119294:120754, ack 2546, win 501, length 1460
10:53:10.901355 IP felstaube.cs.sbg.ac.at.ssh > 192.168.0.16.49587: Flags [.], seq 120754:122214, ack 2546, win 501, length 1460
10:53:10.901370 IP felstaube.cs.sbg.ac.at.ssh > 192.168.0.16.49587: Flags [.], seq 122214:123674, ack 2546, win 501, length 1460
10:53:10.901615 IP felstaube.cs.sbg.ac.at.ssh > 192.168.0.16.49587: Flags [.], seq 123674:125134, ack 2546, win 501, length 1460
10:53:10.901616 IP felstaube.cs.sbg.ac.at.ssh > 192.168.0.16.49587: Flags [.], seq 125134:126594, ack 2546, win 501, length 1460
10:53:10.901828 IP felstaube.cs.sbg.ac.at.ssh > 192.168.0.16.49587: Flags [.], seq 126594:128054, ack 2546, win 501, length 1460
10:53:10.902173 IP felstaube.cs.sbg.ac.at.ssh > 192.168.0.16.49587: Flags [.], seq 128054:129514, ack 2546, win 501, length 1460
10:53:10.902175 IP felstaube.cs.sbg.ac.at.ssh > 192.168.0.16.49587: Flags [.], seq 129514:130974, ack 2546, win 501, length 1460
10:53:10.903877 IP felstaube.cs.sbg.ac.at.ssh > 192.168.0.16.49587: Flags [.], seq 130974:132434, ack 2546, win 501, length 1460
10:53:10.903880 IP felstaube.cs.sbg.ac.at.ssh > 192.168.0.16.49587: Flags [.], seq 132434:133894, ack 2546, win 501, length 1460
10:53:10.904098 IP felstaube.cs.sbg.ac.at.ssh > 192.168.0.16.49587: Flags [.], seq 133894:135354, ack 2546, win 501, length 1460
10:53:10.904099 IP felstaube.cs.sbg.ac.at.ssh > 192.168.0.16.49587: Flags [.], seq 135354:136814, ack 2546, win 501, length 1460
10:53:10.904419 IP felstaube.cs.sbg.ac.at.ssh > 192.168.0.16.49587: Flags [.], seq 136814:138274, ack 2546, win 501, length 1460
10:53:10.904423 IP felstaube.cs.sbg.ac.at.ssh > 192.168.0.16.49587: Flags [.], seq 138274:139734, ack 2546, win 501, length 1460
10:53:10.904552 IP felstaube.cs.sbg.ac.at.ssh > 192.168.0.16.49587: Flags [.], seq 139734:141194, ack 2546, win 501, length 1460
10:53:10.904668 IP felstaube.cs.sbg.ac.at.ssh > 192.168.0.16.49587: Flags [.], seq 141194:142654, ack 2546, win 501, length 1460
10:53:10.904810 IP felstaube.cs.sbg.ac.at.ssh > 192.168.0.16.49587: Flags [.], seq 142654:144114, ack 2546, win 501, length 1460
10:53:10.905106 IP felstaube.cs.sbg.ac.at.ssh > 192.168.0.16.49587: Flags [.], seq 144114:145574, ack 2546, win 501, length 1460
10:53:10.905110 IP felstaube.cs.sbg.ac.at.ssh > 192.168.0.16.49587: Flags [.], seq 145574:147034, ack 2546, win 501, length 1460
10:53:10.905680 IP felstaube.cs.sbg.ac.at.ssh > 192.168.0.16.49587: Flags [.], seq 147034:148494, ack 2546, win 501, length 1460
10:53:10.908121 IP felstaube.cs.sbg.ac.at.ssh > 192.168.0.16.49587: Flags [.], seq 148494:149954, ack 2546, win 501, length 1460
10:53:10.908124 IP felstaube.cs.sbg.ac.at.ssh > 192.168.0.16.49587: Flags [.], seq 149954:151414, ack 2546, win 501, length 1460
10:53:10.908340 IP felstaube.cs.sbg.ac.at.ssh > 192.168.0.16.49587: Flags [.], seq 151414:152874, ack 2546, win 501, length 1460
10:53:10.908341 IP felstaube.cs.sbg.ac.at.ssh > 192.168.0.16.49587: Flags [.], seq 152874:154334, ack 2546, win 501, length 1460
10:53:10.908641 IP felstaube.cs.sbg.ac.at.ssh > 192.168.0.16.49587: Flags [.], seq 154334:155794, ack 2546, win 501, length 1460
10:53:10.908644 IP felstaube.cs.sbg.ac.at.ssh > 192.168.0.16.49587: Flags [.], seq 155794:157254, ack 2546, win 501, length 1460
10:53:10.908774 IP felstaube.cs.sbg.ac.at.ssh > 192.168.0.16.49587: Flags [.], seq 157254:158714, ack 2546, win 501, length 1460
10:53:10.908917 IP felstaube.cs.sbg.ac.at.ssh > 192.168.0.16.49587: Flags [.], seq 158714:160174, ack 2546, win 501, length 1460
10:53:10.909059 IP felstaube.cs.sbg.ac.at.ssh > 192.168.0.16.49587: Flags [.], seq 160174:161634, ack 2546, win 501, length 1460
10:53:10.909166 IP felstaube.cs.sbg.ac.at.ssh > 192.168.0.16.49587: Flags [.], seq 161634:163094, ack 2546, win 501, length 1460
10:53:10.909268 IP felstaube.cs.sbg.ac.at.ssh > 192.168.0.16.49587: Flags [.], seq 163094:164554, ack 2546, win 501, length 1460
10:53:10.909405 IP felstaube.cs.sbg.ac.at.ssh > 192.168.0.16.49587: Flags [.], seq 164554:166014, ack 2546, win 501, length 1460
10:53:10.909518 IP felstaube.cs.sbg.ac.at.ssh > 192.168.0.16.49587: Flags [.], seq 166014:167474, ack 2546, win 501, length 1460
10:53:10.909687 IP felstaube.cs.sbg.ac.at.ssh > 192.168.0.16.49587: Flags [.], seq 167474:168934, ack 2546, win 501, length 1460
10:53:10.909703 IP felstaube.cs.sbg.ac.at.ssh > 192.168.0.16.49587: Flags [.], seq 168934:170394, ack 2546, win 501, length 1460
10:53:10.909911 IP felstaube.cs.sbg.ac.at.ssh > 192.168.0.16.49587: Flags [.], seq 170394:171854, ack 2546, win 501, length 1460
10:53:10.910078 IP felstaube.cs.sbg.ac.at.ssh > 192.168.0.16.49587: Flags [.], seq 171854:173314, ack 2546, win 501, length 1460
10:53:10.910079 IP felstaube.cs.sbg.ac.at.ssh > 192.168.0.16.49587: Flags [.], seq 173314:174774, ack 2546, win 501, length 1460
10:53:10.910250 IP felstaube.cs.sbg.ac.at.ssh > 192.168.0.16.49587: Flags [.], seq 174774:176234, ack 2546, win 501, length 1460
10:53:10.910415 IP felstaube.cs.sbg.ac.at.ssh > 192.168.0.16.49587: Flags [.], seq 176234:177694, ack 2546, win 501, length 1460
10:53:10.910605 IP felstaube.cs.sbg.ac.at.ssh > 192.168.0.16.49587: Flags [.], seq 177694:179154, ack 2546, win 501, length 1460
10:53:10.910608 IP felstaube.cs.sbg.ac.at.ssh > 192.168.0.16.49587: Flags [.], seq 179154:180614, ack 2546, win 501, length 1460
10:53:10.910765 IP felstaube.cs.sbg.ac.at.ssh > 192.168.0.16.49587: Flags [.], seq 180614:182074, ack 2546, win 501, length 1460
10:53:10.910918 IP felstaube.cs.sbg.ac.at.ssh > 192.168.0.16.49587: Flags [.], seq 182074:183534, ack 2546, win 501, length 1460
10:53:10.910919 IP felstaube.cs.sbg.ac.at.ssh > 192.168.0.16.49587: Flags [.], seq 183534:184994, ack 2546, win 501, length 1460
10:53:10.911148 IP felstaube.cs.sbg.ac.at.ssh > 192.168.0.16.49587: Flags [.], seq 184994:186454, ack 2546, win 501, length 1460
10:53:10.911259 IP felstaube.cs.sbg.ac.at.ssh > 192.168.0.16.49587: Flags [.], seq 186454:187914, ack 2546, win 501, length 1460
10:53:10.911397 IP felstaube.cs.sbg.ac.at.ssh > 192.168.0.16.49587: Flags [.], seq 187914:189374, ack 2546, win 501, length 1460
10:53:10.911631 IP felstaube.cs.sbg.ac.at.ssh > 192.168.0.16.49587: Flags [.], seq 189374:190834, ack 2546, win 501, length 1460
10:53:10.911632 IP felstaube.cs.sbg.ac.at.ssh > 192.168.0.16.49587: Flags [.], seq 190834:192294, ack 2546, win 501, length 1460
10:53:10.911722 IP felstaube.cs.sbg.ac.at.ssh > 192.168.0.16.49587: Flags [.], seq 192294:193754, ack 2546, win 501, length 1460
10:53:10.911852 IP felstaube.cs.sbg.ac.at.ssh > 192.168.0.16.49587: Flags [.], seq 193754:195214, ack 2546, win 501, length 1460
10:53:10.911973 IP felstaube.cs.sbg.ac.at.ssh > 192.168.0.16.49587: Flags [.], seq 195214:196674, ack 2546, win 501, length 1460
10:53:10.912098 IP felstaube.cs.sbg.ac.at.ssh > 192.168.0.16.49587: Flags [.], seq 196674:198134, ack 2546, win 501, length 1460
10:53:10.912212 IP felstaube.cs.sbg.ac.at.ssh > 192.168.0.16.49587: Flags [.], seq 198134:199594, ack 2546, win 501, length 1460
10:53:10.912524 IP felstaube.cs.sbg.ac.at.ssh > 192.168.0.16.49587: Flags [.], seq 199594:201054, ack 2546, win 501, length 1460
10:53:10.912662 IP felstaube.cs.sbg.ac.at.ssh > 192.168.0.16.49587: Flags [.], seq 201054:202514, ack 2546, win 501, length 1460
10:53:10.912769 IP felstaube.cs.sbg.ac.at.ssh > 192.168.0.16.49587: Flags [.], seq 202514:203974, ack 2546, win 501, length 1460
10:53:10.912900 IP felstaube.cs.sbg.ac.at.ssh > 192.168.0.16.49587: Flags [.], seq 203974:205434, ack 2546, win 501, length 1460
10:53:10.913015 IP felstaube.cs.sbg.ac.at.ssh > 192.168.0.16.49587: Flags [.], seq 205434:206894, ack 2546, win 501, length 1460
10:53:10.918754 IP felstaube.cs.sbg.ac.at.ssh > 192.168.0.16.49587: Flags [.], seq 206894:208354, ack 2546, win 501, length 1460
10:53:10.918755 IP felstaube.cs.sbg.ac.at.ssh > 192.168.0.16.49587: Flags [.], seq 208354:209814, ack 2546, win 501, length 1460
10:53:10.918928 IP felstaube.cs.sbg.ac.at.ssh > 192.168.0.16.49587: Flags [.], seq 209814:211274, ack 2546, win 501, length 1460
10:53:10.918929 IP felstaube.cs.sbg.ac.at.ssh > 192.168.0.16.49587: Flags [.], seq 211274:212734, ack 2546, win 501, length 1460
10:53:10.919160 IP felstaube.cs.sbg.ac.at.ssh > 192.168.0.16.49587: Flags [.], seq 212734:214194, ack 2546, win 501, length 1460
10:53:10.919273 IP felstaube.cs.sbg.ac.at.ssh > 192.168.0.16.49587: Flags [.], seq 214194:215654, ack 2546, win 501, length 1460
10:53:10.920048 IP felstaube.cs.sbg.ac.at.ssh > 192.168.0.16.49587: Flags [.], seq 215654:217114, ack 2546, win 501, length 1460
10:53:10.920052 IP felstaube.cs.sbg.ac.at.ssh > 192.168.0.16.49587: Flags [.], seq 217114:218574, ack 2546, win 501, length 1460
10:53:10.921376 IP felstaube.cs.sbg.ac.at.ssh > 192.168.0.16.49587: Flags [.], seq 218574:220034, ack 2546, win 501, length 1460
10:53:10.921377 IP felstaube.cs.sbg.ac.at.ssh > 192.168.0.16.49587: Flags [.], seq 220034:221494, ack 2546, win 501, length 1460
10:53:10.921591 IP felstaube.cs.sbg.ac.at.ssh > 192.168.0.16.49587: Flags [.], seq 221494:222954, ack 2546, win 501, length 1460
10:53:10.921595 IP felstaube.cs.sbg.ac.at.ssh > 192.168.0.16.49587: Flags [.], seq 222954:224414, ack 2546, win 501, length 1460
10:53:10.921793 IP felstaube.cs.sbg.ac.at.ssh > 192.168.0.16.49587: Flags [.], seq 224414:225874, ack 2546, win 501, length 1460
10:53:10.921794 IP felstaube.cs.sbg.ac.at.ssh > 192.168.0.16.49587: Flags [.], seq 225874:227334, ack 2546, win 501, length 1460
10:53:10.922016 IP felstaube.cs.sbg.ac.at.ssh > 192.168.0.16.49587: Flags [.], seq 227334:228794, ack 2546, win 501, length 1460
10:53:10.922167 IP felstaube.cs.sbg.ac.at.ssh > 192.168.0.16.49587: Flags [.], seq 228794:230254, ack 2546, win 501, length 1460
10:53:10.922181 IP felstaube.cs.sbg.ac.at.ssh > 192.168.0.16.49587: Flags [.], seq 230254:231714, ack 2546, win 501, length 1460
10:53:10.922424 IP felstaube.cs.sbg.ac.at.ssh > 192.168.0.16.49587: Flags [.], seq 231714:233174, ack 2546, win 501, length 1460
10:53:10.922427 IP felstaube.cs.sbg.ac.at.ssh > 192.168.0.16.49587: Flags [.], seq 233174:234634, ack 2546, win 501, length 1460
10:53:10.922632 IP felstaube.cs.sbg.ac.at.ssh > 192.168.0.16.49587: Flags [.], seq 234634:236094, ack 2546, win 501, length 1460
10:53:10.923141 IP felstaube.cs.sbg.ac.at.ssh > 192.168.0.16.49587: Flags [.], seq 236094:237554, ack 2546, win 501, length 1460
10:53:10.923142 IP felstaube.cs.sbg.ac.at.ssh > 192.168.0.16.49587: Flags [.], seq 237554:239014, ack 2546, win 501, length 1460
10:53:10.923394 IP felstaube.cs.sbg.ac.at.ssh > 192.168.0.16.49587: Flags [.], seq 239014:240474, ack 2546, win 501, length 1460
10:53:10.923397 IP felstaube.cs.sbg.ac.at.ssh > 192.168.0.16.49587: Flags [.], seq 240474:241934, ack 2546, win 501, length 1460
10:53:10.923528 IP felstaube.cs.sbg.ac.at.ssh > 192.168.0.16.49587: Flags [.], seq 241934:243394, ack 2546, win 501, length 1460
10:53:10.923707 IP felstaube.cs.sbg.ac.at.ssh > 192.168.0.16.49587: Flags [.], seq 243394:244854, ack 2546, win 501, length 1460
10:53:10.923708 IP felstaube.cs.sbg.ac.at.ssh > 192.168.0.16.49587: Flags [.], seq 244854:246314, ack 2546, win 501, length 1460
10:53:10.923906 IP felstaube.cs.sbg.ac.at.ssh > 192.168.0.16.49587: Flags [.], seq 246314:247774, ack 2546, win 501, length 1460
10:53:10.924140 IP felstaube.cs.sbg.ac.at.ssh > 192.168.0.16.49587: Flags [.], seq 247774:249234, ack 2546, win 501, length 1460
10:53:10.924144 IP felstaube.cs.sbg.ac.at.ssh > 192.168.0.16.49587: Flags [.], seq 249234:250694, ack 2546, win 501, length 1460
10:53:10.924266 IP felstaube.cs.sbg.ac.at.ssh > 192.168.0.16.49587: Flags [.], seq 250694:252154, ack 2546, win 501, length 1460
10:53:10.924426 IP felstaube.cs.sbg.ac.at.ssh > 192.168.0.16.49587: Flags [.], seq 252154:253614, ack 2546, win 501, length 1460
10:53:10.924831 IP felstaube.cs.sbg.ac.at.ssh > 192.168.0.16.49587: Flags [.], seq 253614:255074, ack 2546, win 501, length 1460
10:53:10.924835 IP felstaube.cs.sbg.ac.at.ssh > 192.168.0.16.49587: Flags [.], seq 255074:256534, ack 2546, win 501, length 1460
10:53:10.925055 IP felstaube.cs.sbg.ac.at.ssh > 192.168.0.16.49587: Flags [.], seq 256534:257994, ack 2546, win 501, length 1460
10:53:10.925057 IP felstaube.cs.sbg.ac.at.ssh > 192.168.0.16.49587: Flags [.], seq 257994:259454, ack 2546, win 501, length 1460
10:53:10.925281 IP felstaube.cs.sbg.ac.at.ssh > 192.168.0.16.49587: Flags [.], seq 259454:260914, ack 2546, win 501, length 1460
10:53:10.925592 IP felstaube.cs.sbg.ac.at.ssh > 192.168.0.16.49587: Flags [.], seq 260914:262374, ack 2546, win 501, length 1460
10:53:10.925594 IP felstaube.cs.sbg.ac.at.ssh > 192.168.0.16.49587: Flags [.], seq 262374:263834, ack 2546, win 501, length 1460
10:53:10.925596 IP felstaube.cs.sbg.ac.at.ssh > 192.168.0.16.49587: Flags [.], seq 263834:265294, ack 2546, win 501, length 1460
10:53:10.925741 IP felstaube.cs.sbg.ac.at.ssh > 192.168.0.16.49587: Flags [.], seq 265294:266754, ack 2546, win 501, length 1460
10:53:10.925920 IP felstaube.cs.sbg.ac.at.ssh > 192.168.0.16.49587: Flags [.], seq 266754:268214, ack 2546, win 501, length 1460
10:53:10.925923 IP felstaube.cs.sbg.ac.at.ssh > 192.168.0.16.49587: Flags [.], seq 268214:269674, ack 2546, win 501, length 1460
10:53:10.926139 IP felstaube.cs.sbg.ac.at.ssh > 192.168.0.16.49587: Flags [.], seq 269674:271134, ack 2546, win 501, length 1460
10:53:10.926258 IP felstaube.cs.sbg.ac.at.ssh > 192.168.0.16.49587: Flags [.], seq 271134:272594, ack 2546, win 501, length 1460
10:53:10.926524 IP felstaube.cs.sbg.ac.at.ssh > 192.168.0.16.49587: Flags [.], seq 272594:274054, ack 2546, win 501, length 1460
10:53:10.926670 IP felstaube.cs.sbg.ac.at.ssh > 192.168.0.16.49587: Flags [.], seq 274054:275514, ack 2546, win 501, length 1460
10:53:10.926756 IP felstaube.cs.sbg.ac.at.ssh > 192.168.0.16.49587: Flags [.], seq 275514:276974, ack 2546, win 501, length 1460
10:53:10.926903 IP felstaube.cs.sbg.ac.at.ssh > 192.168.0.16.49587: Flags [.], seq 276974:278434, ack 2546, win 501, length 1460
10:53:10.927032 IP felstaube.cs.sbg.ac.at.ssh > 192.168.0.16.49587: Flags [.], seq 278434:279894, ack 2546, win 501, length 1460
10:53:10.927146 IP felstaube.cs.sbg.ac.at.ssh > 192.168.0.16.49587: Flags [.], seq 279894:281354, ack 2546, win 501, length 1460
10:53:10.927297 IP felstaube.cs.sbg.ac.at.ssh > 192.168.0.16.49587: Flags [.], seq 281354:282814, ack 2546, win 501, length 1460
10:53:10.927300 IP felstaube.cs.sbg.ac.at.ssh > 192.168.0.16.49587: Flags [.], seq 282814:284274, ack 2546, win 501, length 1460
10:53:10.927525 IP felstaube.cs.sbg.ac.at.ssh > 192.168.0.16.49587: Flags [.], seq 284274:285734, ack 2546, win 501, length 1460
10:53:10.927613 IP felstaube.cs.sbg.ac.at.ssh > 192.168.0.16.49587: Flags [.], seq 285734:287194, ack 2546, win 501, length 1460
10:53:10.927744 IP felstaube.cs.sbg.ac.at.ssh > 192.168.0.16.49587: Flags [.], seq 287194:288654, ack 2546, win 501, length 1460
10:53:10.927864 IP felstaube.cs.sbg.ac.at.ssh > 192.168.0.16.49587: Flags [.], seq 288654:290114, ack 2546, win 501, length 1460
10:53:10.928004 IP felstaube.cs.sbg.ac.at.ssh > 192.168.0.16.49587: Flags [.], seq 290114:291574, ack 2546, win 501, length 1460
10:53:10.928268 IP felstaube.cs.sbg.ac.at.ssh > 192.168.0.16.49587: Flags [.], seq 291574:293034, ack 2546, win 501, length 1460
10:53:10.928383 IP felstaube.cs.sbg.ac.at.ssh > 192.168.0.16.49587: Flags [.], seq 293034:294494, ack 2546, win 501, length 1460
10:53:10.928514 IP felstaube.cs.sbg.ac.at.ssh > 192.168.0.16.49587: Flags [.], seq 294494:295954, ack 2546, win 501, length 1460
10:53:10.928637 IP felstaube.cs.sbg.ac.at.ssh > 192.168.0.16.49587: Flags [.], seq 295954:297414, ack 2546, win 501, length 1460
10:53:10.928760 IP felstaube.cs.sbg.ac.at.ssh > 192.168.0.16.49587: Flags [.], seq 297414:298874, ack 2546, win 501, length 1460
10:53:10.928876 IP felstaube.cs.sbg.ac.at.ssh > 192.168.0.16.49587: Flags [.], seq 298874:300334, ack 2546, win 501, length 1460
10:53:10.929006 IP felstaube.cs.sbg.ac.at.ssh > 192.168.0.16.49587: Flags [.], seq 300334:301794, ack 2546, win 501, length 1460
10:53:10.929120 IP felstaube.cs.sbg.ac.at.ssh > 192.168.0.16.49587: Flags [.], seq 301794:303254, ack 2546, win 501, length 1460
10:53:10.929261 IP felstaube.cs.sbg.ac.at.ssh > 192.168.0.16.49587: Flags [.], seq 303254:304714, ack 2546, win 501, length 1460
10:53:10.929371 IP felstaube.cs.sbg.ac.at.ssh > 192.168.0.16.49587: Flags [.], seq 304714:306174, ack 2546, win 501, length 1460
10:53:10.929497 IP felstaube.cs.sbg.ac.at.ssh > 192.168.0.16.49587: Flags [.], seq 306174:307634, ack 2546, win 501, length 1460
10:53:10.929612 IP felstaube.cs.sbg.ac.at.ssh > 192.168.0.16.49587: Flags [.], seq 307634:309094, ack 2582, win 501, length 1460
10:53:10.929997 IP felstaube.cs.sbg.ac.at.ssh > 192.168.0.16.49587: Flags [.], seq 309094:310554, ack 2582, win 501, length 1460
10:53:10.930120 IP felstaube.cs.sbg.ac.at.ssh > 192.168.0.16.49587: Flags [.], seq 310554:312014, ack 2582, win 501, length 1460
10:53:10.930236 IP felstaube.cs.sbg.ac.at.ssh > 192.168.0.16.49587: Flags [.], seq 312014:313474, ack 2582, win 501, length 1460
10:53:10.930365 IP felstaube.cs.sbg.ac.at.ssh > 192.168.0.16.49587: Flags [.], seq 313474:314934, ack 2582, win 501, length 1460
10:53:10.931381 IP felstaube.cs.sbg.ac.at.ssh > 192.168.0.16.49587: Flags [.], seq 314934:316394, ack 2582, win 501, length 1460
10:53:10.931477 IP felstaube.cs.sbg.ac.at.ssh > 192.168.0.16.49587: Flags [.], seq 316394:317854, ack 2582, win 501, length 1460
10:53:10.931594 IP felstaube.cs.sbg.ac.at.ssh > 192.168.0.16.49587: Flags [.], seq 317854:319314, ack 2582, win 501, length 1460
10:53:10.931709 IP felstaube.cs.sbg.ac.at.ssh > 192.168.0.16.49587: Flags [.], seq 319314:320774, ack 2582, win 501, length 1460
10:53:10.931840 IP felstaube.cs.sbg.ac.at.ssh > 192.168.0.16.49587: Flags [.], seq 320774:322234, ack 2582, win 501, length 1460
10:53:10.931955 IP felstaube.cs.sbg.ac.at.ssh > 192.168.0.16.49587: Flags [.], seq 322234:323694, ack 2582, win 501, length 1460
10:53:10.932086 IP felstaube.cs.sbg.ac.at.ssh > 192.168.0.16.49587: Flags [.], seq 323694:325154, ack 2582, win 501, length 1460
10:53:10.932209 IP felstaube.cs.sbg.ac.at.ssh > 192.168.0.16.49587: Flags [.], seq 325154:326614, ack 2582, win 501, length 1460
10:53:10.932332 IP felstaube.cs.sbg.ac.at.ssh > 192.168.0.16.49587: Flags [.], seq 326614:328074, ack 2582, win 501, length 1460
10:53:10.932463 IP felstaube.cs.sbg.ac.at.ssh > 192.168.0.16.49587: Flags [.], seq 328074:329534, ack 2582, win 501, length 1460
10:53:10.932577 IP felstaube.cs.sbg.ac.at.ssh > 192.168.0.16.49587: Flags [.], seq 329534:330994, ack 2582, win 501, length 1460
10:53:10.932709 IP felstaube.cs.sbg.ac.at.ssh > 192.168.0.16.49587: Flags [.], seq 330994:332454, ack 2582, win 501, length 1460
10:53:10.932833 IP felstaube.cs.sbg.ac.at.ssh > 192.168.0.16.49587: Flags [.], seq 332454:333914, ack 2582, win 501, length 1460
10:53:10.932955 IP felstaube.cs.sbg.ac.at.ssh > 192.168.0.16.49587: Flags [.], seq 333914:335374, ack 2582, win 501, length 1460
10:53:10.933069 IP felstaube.cs.sbg.ac.at.ssh > 192.168.0.16.49587: Flags [.], seq 335374:336834, ack 2582, win 501, length 1460
10:53:10.933200 IP felstaube.cs.sbg.ac.at.ssh > 192.168.0.16.49587: Flags [.], seq 336834:338294, ack 2582, win 501, length 1460
10:53:10.933315 IP felstaube.cs.sbg.ac.at.ssh > 192.168.0.16.49587: Flags [.], seq 338294:339754, ack 2582, win 501, length 1460
10:53:10.933453 IP felstaube.cs.sbg.ac.at.ssh > 192.168.0.16.49587: Flags [.], seq 339754:341214, ack 2582, win 501, length 1460
10:53:10.933561 IP felstaube.cs.sbg.ac.at.ssh > 192.168.0.16.49587: Flags [.], seq 341214:342674, ack 2582, win 501, length 1460
10:53:10.933691 IP felstaube.cs.sbg.ac.at.ssh > 192.168.0.16.49587: Flags [.], seq 342674:344134, ack 2582, win 501, length 1460
10:53:10.933806 IP felstaube.cs.sbg.ac.at.ssh > 192.168.0.16.49587: Flags [.], seq 344134:345594, ack 2582, win 501, length 1460
10:53:10.933937 IP felstaube.cs.sbg.ac.at.ssh > 192.168.0.16.49587: Flags [.], seq 345594:347054, ack 2582, win 501, length 1460
10:53:10.934061 IP felstaube.cs.sbg.ac.at.ssh > 192.168.0.16.49587: Flags [.], seq 347054:348514, ack 2582, win 501, length 1460
10:53:10.934183 IP felstaube.cs.sbg.ac.at.ssh > 192.168.0.16.49587: Flags [.], seq 348514:349974, ack 2582, win 501, length 1460
10:53:10.934297 IP felstaube.cs.sbg.ac.at.ssh > 192.168.0.16.49587: Flags [.], seq 349974:351434, ack 2582, win 501, length 1460
10:53:10.934429 IP felstaube.cs.sbg.ac.at.ssh > 192.168.0.16.49587: Flags [.], seq 351434:352894, ack 2582, win 501, length 1460
10:53:10.934544 IP felstaube.cs.sbg.ac.at.ssh > 192.168.0.16.49587: Flags [.], seq 352894:354354, ack 2582, win 501, length 1460
10:53:10.934682 IP felstaube.cs.sbg.ac.at.ssh > 192.168.0.16.49587: Flags [.], seq 354354:355814, ack 2582, win 501, length 1460
10:53:10.934789 IP felstaube.cs.sbg.ac.at.ssh > 192.168.0.16.49587: Flags [.], seq 355814:357274, ack 2582, win 501, length 1460
10:53:10.934920 IP felstaube.cs.sbg.ac.at.ssh > 192.168.0.16.49587: Flags [.], seq 357274:358734, ack 2582, win 501, length 1460
10:53:10.935035 IP felstaube.cs.sbg.ac.at.ssh > 192.168.0.16.49587: Flags [.], seq 358734:360194, ack 2582, win 501, length 1460
10:53:10.935166 IP felstaube.cs.sbg.ac.at.ssh > 192.168.0.16.49587: Flags [.], seq 360194:361654, ack 2582, win 501, length 1460
10:53:10.935290 IP felstaube.cs.sbg.ac.at.ssh > 192.168.0.16.49587: Flags [.], seq 361654:363114, ack 2582, win 501, length 1460
10:53:10.935412 IP felstaube.cs.sbg.ac.at.ssh > 192.168.0.16.49587: Flags [.], seq 363114:364574, ack 2582, win 501, length 1460
10:53:10.935533 IP felstaube.cs.sbg.ac.at.ssh > 192.168.0.16.49587: Flags [.], seq 364574:366034, ack 2582, win 501, length 1460
10:53:10.935658 IP felstaube.cs.sbg.ac.at.ssh > 192.168.0.16.49587: Flags [.], seq 366034:367494, ack 2582, win 501, length 1460
10:53:10.935772 IP felstaube.cs.sbg.ac.at.ssh > 192.168.0.16.49587: Flags [.], seq 367494:368954, ack 2582, win 501, length 1460
10:53:10.935912 IP felstaube.cs.sbg.ac.at.ssh > 192.168.0.16.49587: Flags [.], seq 368954:370414, ack 2582, win 501, length 1460
10:53:10.936022 IP felstaube.cs.sbg.ac.at.ssh > 192.168.0.16.49587: Flags [.], seq 370414:371874, ack 2582, win 501, length 1460
10:53:10.936149 IP felstaube.cs.sbg.ac.at.ssh > 192.168.0.16.49587: Flags [.], seq 371874:373334, ack 2582, win 501, length 1460
10:53:10.936264 IP felstaube.cs.sbg.ac.at.ssh > 192.168.0.16.49587: Flags [.], seq 373334:374794, ack 2582, win 501, length 1460
10:53:10.936395 IP felstaube.cs.sbg.ac.at.ssh > 192.168.0.16.49587: Flags [.], seq 374794:376254, ack 2582, win 501, length 1460
10:53:10.936518 IP felstaube.cs.sbg.ac.at.ssh > 192.168.0.16.49587: Flags [.], seq 376254:377714, ack 2582, win 501, length 1460
10:53:10.936641 IP felstaube.cs.sbg.ac.at.ssh > 192.168.0.16.49587: Flags [.], seq 377714:379174, ack 2582, win 501, length 1460
10:53:10.937001 IP felstaube.cs.sbg.ac.at.ssh > 192.168.0.16.49587: Flags [.], seq 379174:380634, ack 2582, win 501, length 1460
10:53:10.937125 IP felstaube.cs.sbg.ac.at.ssh > 192.168.0.16.49587: Flags [.], seq 380634:382094, ack 2582, win 501, length 1460
10:53:10.937247 IP felstaube.cs.sbg.ac.at.ssh > 192.168.0.16.49587: Flags [.], seq 382094:383554, ack 2582, win 501, length 1460
10:53:10.937361 IP felstaube.cs.sbg.ac.at.ssh > 192.168.0.16.49587: Flags [.], seq 383554:385014, ack 2582, win 501, length 1460
10:53:10.937492 IP felstaube.cs.sbg.ac.at.ssh > 192.168.0.16.49587: Flags [.], seq 385014:386474, ack 2582, win 501, length 1460
10:53:10.937607 IP felstaube.cs.sbg.ac.at.ssh > 192.168.0.16.49587: Flags [.], seq 386474:387934, ack 2582, win 501, length 1460
10:53:10.937745 IP felstaube.cs.sbg.ac.at.ssh > 192.168.0.16.49587: Flags [.], seq 387934:389394, ack 2582, win 501, length 1460
10:53:10.937853 IP felstaube.cs.sbg.ac.at.ssh > 192.168.0.16.49587: Flags [.], seq 389394:390854, ack 2582, win 501, length 1460
10:53:10.937984 IP felstaube.cs.sbg.ac.at.ssh > 192.168.0.16.49587: Flags [.], seq 390854:392314, ack 2582, win 501, length 1460
10:53:10.938115 IP felstaube.cs.sbg.ac.at.ssh > 192.168.0.16.49587: Flags [.], seq 392314:393774, ack 2582, win 501, length 1460
10:53:10.938244 IP felstaube.cs.sbg.ac.at.ssh > 192.168.0.16.49587: Flags [.], seq 393774:395234, ack 2582, win 501, length 1460
10:53:10.938361 IP felstaube.cs.sbg.ac.at.ssh > 192.168.0.16.49587: Flags [.], seq 395234:396694, ack 2582, win 501, length 1460
10:53:10.938476 IP felstaube.cs.sbg.ac.at.ssh > 192.168.0.16.49587: Flags [.], seq 396694:398154, ack 2582, win 501, length 1460
10:53:10.938608 IP felstaube.cs.sbg.ac.at.ssh > 192.168.0.16.49587: Flags [.], seq 398154:399614, ack 2582, win 501, length 1460
10:53:10.938738 IP felstaube.cs.sbg.ac.at.ssh > 192.168.0.16.49587: Flags [.], seq 399614:401074, ack 2582, win 501, length 1460
10:53:10.938878 IP felstaube.cs.sbg.ac.at.ssh > 192.168.0.16.49587: Flags [.], seq 401074:402534, ack 2582, win 501, length 1460
10:53:10.938988 IP felstaube.cs.sbg.ac.at.ssh > 192.168.0.16.49587: Flags [.], seq 402534:403994, ack 2582, win 501, length 1460
10:53:10.939114 IP felstaube.cs.sbg.ac.at.ssh > 192.168.0.16.49587: Flags [.], seq 403994:405454, ack 2582, win 501, length 1460
10:53:10.939229 IP felstaube.cs.sbg.ac.at.ssh > 192.168.0.16.49587: Flags [.], seq 405454:406914, ack 2582, win 501, length 1460
10:53:10.939360 IP felstaube.cs.sbg.ac.at.ssh > 192.168.0.16.49587: Flags [.], seq 406914:408374, ack 2582, win 501, length 1460
10:53:10.939483 IP felstaube.cs.sbg.ac.at.ssh > 192.168.0.16.49587: Flags [.], seq 408374:409834, ack 2582, win 501, length 1460
10:53:10.939606 IP felstaube.cs.sbg.ac.at.ssh > 192.168.0.16.49587: Flags [.], seq 409834:411294, ack 2582, win 501, length 1460
10:53:10.939721 IP felstaube.cs.sbg.ac.at.ssh > 192.168.0.16.49587: Flags [.], seq 411294:412754, ack 2582, win 501, length 1460
10:53:10.939852 IP felstaube.cs.sbg.ac.at.ssh > 192.168.0.16.49587: Flags [.], seq 412754:414214, ack 2582, win 501, length 1460
10:53:10.939966 IP felstaube.cs.sbg.ac.at.ssh > 192.168.0.16.49587: Flags [.], seq 414214:415674, ack 2582, win 501, length 1460
10:53:10.940107 IP felstaube.cs.sbg.ac.at.ssh > 192.168.0.16.49587: Flags [.], seq 415674:417134, ack 2582, win 501, length 1460
10:53:10.940527 IP felstaube.cs.sbg.ac.at.ssh > 192.168.0.16.49587: Flags [.], seq 417134:418594, ack 2582, win 501, length 1460
10:53:10.940622 IP felstaube.cs.sbg.ac.at.ssh > 192.168.0.16.49587: Flags [.], seq 418594:420054, ack 2582, win 501, length 1460
10:53:10.940760 IP felstaube.cs.sbg.ac.at.ssh > 192.168.0.16.49587: Flags [.], seq 420054:421514, ack 2582, win 501, length 1460
10:53:10.940868 IP felstaube.cs.sbg.ac.at.ssh > 192.168.0.16.49587: Flags [.], seq 421514:422974, ack 2582, win 501, length 1460
10:53:10.940999 IP felstaube.cs.sbg.ac.at.ssh > 192.168.0.16.49587: Flags [.], seq 422974:424434, ack 2582, win 501, length 1460
10:53:10.941113 IP felstaube.cs.sbg.ac.at.ssh > 192.168.0.16.49587: Flags [.], seq 424434:425894, ack 2582, win 501, length 1460
10:53:10.941244 IP felstaube.cs.sbg.ac.at.ssh > 192.168.0.16.49587: Flags [.], seq 425894:427354, ack 2582, win 501, length 1460
10:53:10.941368 IP felstaube.cs.sbg.ac.at.ssh > 192.168.0.16.49587: Flags [.], seq 427354:428814, ack 2582, win 501, length 1460
10:53:10.941491 IP felstaube.cs.sbg.ac.at.ssh > 192.168.0.16.49587: Flags [.], seq 428814:430274, ack 2582, win 501, length 1460
