10:20:06.006777 IP felstaube.cs.sbg.ac.at.ssh > 192.168.0.58.34888: Flags [S.], seq 1675158343, ack 2856978966, win 64240, options [mss 1460,nop,nop,sackOK,nop,wscale 7], length 0
10:20:06.032798 IP felstaube.cs.sbg.ac.at.ssh > 192.168.0.58.34888: Flags [.], ack 44, win 502, length 0
10:20:06.041844 IP felstaube.cs.sbg.ac.at.ssh > 192.168.0.58.34888: Flags [P.], seq 1:42, ack 44, win 502, length 41
10:20:06.065464 IP felstaube.cs.sbg.ac.at.ssh > 192.168.0.58.34888: Flags [P.], seq 42:1122, ack 44, win 502, length 1080
10:20:06.112950 IP felstaube.cs.sbg.ac.at.ssh > 192.168.0.58.34888: Flags [.], ack 1436, win 501, length 0
10:20:06.135492 IP felstaube.cs.sbg.ac.at.ssh > 192.168.0.58.34888: Flags [.], ack 1484, win 501, length 0
10:20:06.144901 IP felstaube.cs.sbg.ac.at.ssh > 192.168.0.58.34888: Flags [P.], seq 1122:1574, ack 1484, win 501, length 452
10:20:06.256880 IP felstaube.cs.sbg.ac.at.ssh > 192.168.0.58.34888: Flags [.], ack 1500, win 501, length 0
10:20:06.280171 IP felstaube.cs.sbg.ac.at.ssh > 192.168.0.58.34888: Flags [.], ack 1544, win 501, length 0
10:20:06.280391 IP felstaube.cs.sbg.ac.at.ssh > 192.168.0.58.34888: Flags [P.], seq 1574:1618, ack 1544, win 501, length 44
10:20:06.314797 IP felstaube.cs.sbg.ac.at.ssh > 192.168.0.58.34888: Flags [P.], seq 1618:1670, ack 1612, win 501, length 52
10:20:06.456536 IP felstaube.cs.sbg.ac.at.ssh > 192.168.0.58.34888: Flags [.], ack 2264, win 501, length 0
10:20:06.468679 IP felstaube.cs.sbg.ac.at.ssh > 192.168.0.58.34888: Flags [P.], seq 1670:1698, ack 2264, win 501, length 28
10:20:06.492914 IP felstaube.cs.sbg.ac.at.ssh > 192.168.0.58.34888: Flags [.], ack 2376, win 501, length 0
10:20:06.604198 IP felstaube.cs.sbg.ac.at.ssh > 192.168.0.58.34888: Flags [P.], seq 1698:2346, ack 2376, win 501, length 648
10:20:06.672216 IP felstaube.cs.sbg.ac.at.ssh > 192.168.0.58.34888: Flags [P.], seq 2346:2390, ack 2376, win 501, length 44
10:20:06.698174 IP felstaube.cs.sbg.ac.at.ssh > 192.168.0.58.34888: Flags [.], ack 2504, win 501, length 0
10:20:06.698895 IP felstaube.cs.sbg.ac.at.ssh > 192.168.0.58.34888: Flags [P.], seq 2390:2462, ack 2504, win 501, length 72
10:20:06.723239 IP felstaube.cs.sbg.ac.at.ssh > 192.168.0.58.34888: Flags [P.], seq 2462:2514, ack 2540, win 501, length 52
10:20:06.786496 IP felstaube.cs.sbg.ac.at.ssh > 192.168.0.58.34888: Flags [.], seq 2514:3974, ack 2576, win 501, length 1460
10:20:06.787777 IP felstaube.cs.sbg.ac.at.ssh > 192.168.0.58.34888: Flags [.], seq 3974:5434, ack 2576, win 501, length 1460
10:20:06.789704 IP felstaube.cs.sbg.ac.at.ssh > 192.168.0.58.34888: Flags [.], seq 5434:6894, ack 2576, win 501, length 1460
10:20:06.791005 IP felstaube.cs.sbg.ac.at.ssh > 192.168.0.58.34888: Flags [.], seq 6894:8354, ack 2576, win 501, length 1460
10:20:06.791234 IP felstaube.cs.sbg.ac.at.ssh > 192.168.0.58.34888: Flags [.], seq 8354:9814, ack 2576, win 501, length 1460
10:20:06.791321 IP felstaube.cs.sbg.ac.at.ssh > 192.168.0.58.34888: Flags [.], seq 9814:11274, ack 2576, win 501, length 1460
10:20:06.793251 IP felstaube.cs.sbg.ac.at.ssh > 192.168.0.58.34888: Flags [.], seq 11274:12734, ack 2576, win 501, length 1460
10:20:06.793379 IP felstaube.cs.sbg.ac.at.ssh > 192.168.0.58.34888: Flags [.], seq 12734:14194, ack 2576, win 501, length 1460
10:20:06.793460 IP felstaube.cs.sbg.ac.at.ssh > 192.168.0.58.34888: Flags [.], seq 14194:15654, ack 2576, win 501, length 1460
10:20:06.793536 IP felstaube.cs.sbg.ac.at.ssh > 192.168.0.58.34888: Flags [.], seq 15654:17114, ack 2576, win 501, length 1460
10:20:06.811522 IP felstaube.cs.sbg.ac.at.ssh > 192.168.0.58.34888: Flags [.], seq 17114:18574, ack 2576, win 501, length 1460
10:20:06.812948 IP felstaube.cs.sbg.ac.at.ssh > 192.168.0.58.34888: Flags [.], seq 18574:20034, ack 2576, win 501, length 1460
10:20:06.813190 IP felstaube.cs.sbg.ac.at.ssh > 192.168.0.58.34888: Flags [.], seq 20034:21494, ack 2576, win 501, length 1460
10:20:06.813280 IP felstaube.cs.sbg.ac.at.ssh > 192.168.0.58.34888: Flags [.], seq 21494:22954, ack 2576, win 501, length 1460
10:20:06.818014 IP felstaube.cs.sbg.ac.at.ssh > 192.168.0.58.34888: Flags [.], seq 22954:24414, ack 2576, win 501, length 1460
10:20:06.818809 IP felstaube.cs.sbg.ac.at.ssh > 192.168.0.58.34888: Flags [.], seq 24414:25874, ack 2576, win 501, length 1460
10:20:06.819923 IP felstaube.cs.sbg.ac.at.ssh > 192.168.0.58.34888: Flags [.], seq 25874:27334, ack 2576, win 501, length 1460
10:20:06.820016 IP felstaube.cs.sbg.ac.at.ssh > 192.168.0.58.34888: Flags [.], seq 27334:28794, ack 2576, win 501, length 1460
10:20:06.820090 IP felstaube.cs.sbg.ac.at.ssh > 192.168.0.58.34888: Flags [.], seq 28794:30254, ack 2576, win 501, length 1460
10:20:06.821317 IP felstaube.cs.sbg.ac.at.ssh > 192.168.0.58.34888: Flags [.], seq 30254:31714, ack 2576, win 501, length 1460
10:20:06.821414 IP felstaube.cs.sbg.ac.at.ssh > 192.168.0.58.34888: Flags [.], seq 31714:33174, ack 2576, win 501, length 1460
10:20:06.821490 IP felstaube.cs.sbg.ac.at.ssh > 192.168.0.58.34888: Flags [.], seq 33174:34634, ack 2576, win 501, length 1460
10:20:06.822430 IP felstaube.cs.sbg.ac.at.ssh > 192.168.0.58.34888: Flags [.], seq 34634:36094, ack 2576, win 501, length 1460
10:20:06.822544 IP felstaube.cs.sbg.ac.at.ssh > 192.168.0.58.34888: Flags [.], seq 36094:37554, ack 2576, win 501, length 1460
10:20:06.823641 IP felstaube.cs.sbg.ac.at.ssh > 192.168.0.58.34888: Flags [.], seq 37554:39014, ack 2576, win 501, length 1460
10:20:06.823737 IP felstaube.cs.sbg.ac.at.ssh > 192.168.0.58.34888: Flags [.], seq 39014:40474, ack 2576, win 501, length 1460
10:20:06.823812 IP felstaube.cs.sbg.ac.at.ssh > 192.168.0.58.34888: Flags [.], seq 40474:41934, ack 2576, win 501, length 1460
10:20:06.823878 IP felstaube.cs.sbg.ac.at.ssh > 192.168.0.58.34888: Flags [.], seq 41934:43394, ack 2576, win 501, length 1460
10:20:06.826044 IP felstaube.cs.sbg.ac.at.ssh > 192.168.0.58.34888: Flags [.], seq 43394:44854, ack 2576, win 501, length 1460
10:20:06.826156 IP felstaube.cs.sbg.ac.at.ssh > 192.168.0.58.34888: Flags [.], seq 44854:46314, ack 2576, win 501, length 1460
10:20:06.855362 IP felstaube.cs.sbg.ac.at.ssh > 192.168.0.58.34888: Flags [.], seq 46314:47774, ack 2576, win 501, length 1460
10:20:06.857294 IP felstaube.cs.sbg.ac.at.ssh > 192.168.0.58.34888: Flags [.], seq 47774:49234, ack 2576, win 501, length 1460
10:20:06.857534 IP felstaube.cs.sbg.ac.at.ssh > 192.168.0.58.34888: Flags [.], seq 49234:50694, ack 2576, win 501, length 1460
10:20:06.857625 IP felstaube.cs.sbg.ac.at.ssh > 192.168.0.58.34888: Flags [.], seq 50694:52154, ack 2576, win 501, length 1460
10:20:06.857699 IP felstaube.cs.sbg.ac.at.ssh > 192.168.0.58.34888: Flags [.], seq 52154:53614, ack 2576, win 501, length 1460
10:20:06.861018 IP felstaube.cs.sbg.ac.at.ssh > 192.168.0.58.34888: Flags [.], seq 53614:55074, ack 2576, win 501, length 1460
10:20:06.861135 IP felstaube.cs.sbg.ac.at.ssh > 192.168.0.58.34888: Flags [.], seq 55074:56534, ack 2576, win 501, length 1460
10:20:06.861212 IP felstaube.cs.sbg.ac.at.ssh > 192.168.0.58.34888: Flags [.], seq 56534:57994, ack 2576, win 501, length 1460
10:20:06.863751 IP felstaube.cs.sbg.ac.at.ssh > 192.168.0.58.34888: Flags [.], seq 57994:59454, ack 2576, win 501, length 1460
10:20:06.863877 IP felstaube.cs.sbg.ac.at.ssh > 192.168.0.58.34888: Flags [.], seq 59454:60914, ack 2576, win 501, length 1460
10:20:06.863948 IP felstaube.cs.sbg.ac.at.ssh > 192.168.0.58.34888: Flags [.], seq 60914:62374, ack 2576, win 501, length 1460
10:20:06.864016 IP felstaube.cs.sbg.ac.at.ssh > 192.168.0.58.34888: Flags [.], seq 62374:63834, ack 2576, win 501, length 1460
10:20:06.865208 IP felstaube.cs.sbg.ac.at.ssh > 192.168.0.58.34888: Flags [.], seq 63834:65294, ack 2576, win 501, length 1460
10:20:06.865316 IP felstaube.cs.sbg.ac.at.ssh > 192.168.0.58.34888: Flags [.], seq 65294:66754, ack 2576, win 501, length 1460
10:20:06.866414 IP felstaube.cs.sbg.ac.at.ssh > 192.168.0.58.34888: Flags [P.], seq 66754:68194, ack 2576, win 501, length 1440
10:20:06.866529 IP felstaube.cs.sbg.ac.at.ssh > 192.168.0.58.34888: Flags [.], seq 68194:69654, ack 2576, win 501, length 1460
10:20:06.866610 IP felstaube.cs.sbg.ac.at.ssh > 192.168.0.58.34888: Flags [.], seq 69654:71114, ack 2576, win 501, length 1460
10:20:06.866681 IP felstaube.cs.sbg.ac.at.ssh > 192.168.0.58.34888: Flags [.], seq 71114:72574, ack 2576, win 501, length 1460
10:20:06.867560 IP felstaube.cs.sbg.ac.at.ssh > 192.168.0.58.34888: Flags [.], seq 72574:74034, ack 2576, win 501, length 1460
10:20:06.867666 IP felstaube.cs.sbg.ac.at.ssh > 192.168.0.58.34888: Flags [.], seq 74034:75494, ack 2576, win 501, length 1460
10:20:06.867751 IP felstaube.cs.sbg.ac.at.ssh > 192.168.0.58.34888: Flags [.], seq 75494:76954, ack 2576, win 501, length 1460
10:20:06.867822 IP felstaube.cs.sbg.ac.at.ssh > 192.168.0.58.34888: Flags [.], seq 76954:78414, ack 2576, win 501, length 1460
10:20:06.871426 IP felstaube.cs.sbg.ac.at.ssh > 192.168.0.58.34888: Flags [.], seq 78414:79874, ack 2576, win 501, length 1460
10:20:06.871568 IP felstaube.cs.sbg.ac.at.ssh > 192.168.0.58.34888: Flags [.], seq 79874:81334, ack 2576, win 501, length 1460
10:20:06.871778 IP felstaube.cs.sbg.ac.at.ssh > 192.168.0.58.34888: Flags [.], seq 81334:82794, ack 2576, win 501, length 1460
10:20:06.871856 IP felstaube.cs.sbg.ac.at.ssh > 192.168.0.58.34888: Flags [.], seq 82794:84254, ack 2576, win 501, length 1460
10:20:06.872896 IP felstaube.cs.sbg.ac.at.ssh > 192.168.0.58.34888: Flags [.], seq 84254:85714, ack 2576, win 501, length 1460
10:20:06.873011 IP felstaube.cs.sbg.ac.at.ssh > 192.168.0.58.34888: Flags [.], seq 85714:87174, ack 2576, win 501, length 1460
10:20:06.873207 IP felstaube.cs.sbg.ac.at.ssh > 192.168.0.58.34888: Flags [.], seq 87174:88634, ack 2576, win 501, length 1460
10:20:06.873284 IP felstaube.cs.sbg.ac.at.ssh > 192.168.0.58.34888: Flags [.], seq 88634:90094, ack 2576, win 501, length 1460
10:20:06.873433 IP felstaube.cs.sbg.ac.at.ssh > 192.168.0.58.34888: Flags [.], seq 90094:91554, ack 2576, win 501, length 1460
10:20:06.874196 IP felstaube.cs.sbg.ac.at.ssh > 192.168.0.58.34888: Flags [.], seq 91554:93014, ack 2576, win 501, length 1460
10:20:06.874421 IP felstaube.cs.sbg.ac.at.ssh > 192.168.0.58.34888: Flags [.], seq 93014:94474, ack 2576, win 501, length 1460
10:20:06.874500 IP felstaube.cs.sbg.ac.at.ssh > 192.168.0.58.34888: Flags [.], seq 94474:95934, ack 2576, win 501, length 1460
10:20:06.876323 IP felstaube.cs.sbg.ac.at.ssh > 192.168.0.58.34888: Flags [.], seq 95934:97394, ack 2576, win 501, length 1460
10:20:06.876450 IP felstaube.cs.sbg.ac.at.ssh > 192.168.0.58.34888: Flags [.], seq 97394:98854, ack 2576, win 501, length 1460
10:20:06.876642 IP felstaube.cs.sbg.ac.at.ssh > 192.168.0.58.34888: Flags [.], seq 98854:100314, ack 2576, win 501, length 1460
10:20:06.876731 IP felstaube.cs.sbg.ac.at.ssh > 192.168.0.58.34888: Flags [.], seq 100314:101774, ack 2576, win 501, length 1460
10:20:06.876870 IP felstaube.cs.sbg.ac.at.ssh > 192.168.0.58.34888: Flags [P.], seq 101774:103234, ack 2576, win 501, length 1460
10:20:06.877870 IP felstaube.cs.sbg.ac.at.ssh > 192.168.0.58.34888: Flags [.], seq 103234:104694, ack 2576, win 501, length 1460
10:20:06.897321 IP felstaube.cs.sbg.ac.at.ssh > 192.168.0.58.34888: Flags [.], seq 104694:106154, ack 2576, win 501, length 1460
10:20:06.899008 IP felstaube.cs.sbg.ac.at.ssh > 192.168.0.58.34888: Flags [.], seq 106154:107614, ack 2576, win 501, length 1460
10:20:06.899229 IP felstaube.cs.sbg.ac.at.ssh > 192.168.0.58.34888: Flags [.], seq 107614:109074, ack 2576, win 501, length 1460
10:20:06.899306 IP felstaube.cs.sbg.ac.at.ssh > 192.168.0.58.34888: Flags [.], seq 109074:110534, ack 2576, win 501, length 1460
10:20:06.899435 IP felstaube.cs.sbg.ac.at.ssh > 192.168.0.58.34888: Flags [.], seq 110534:111994, ack 2576, win 501, length 1460
10:20:06.900503 IP felstaube.cs.sbg.ac.at.ssh > 192.168.0.58.34888: Flags [.], seq 111994:113454, ack 2576, win 501, length 1460
10:20:06.900682 IP felstaube.cs.sbg.ac.at.ssh > 192.168.0.58.34888: Flags [.], seq 113454:114914, ack 2576, win 501, length 1460
10:20:06.900752 IP felstaube.cs.sbg.ac.at.ssh > 192.168.0.58.34888: Flags [.], seq 114914:116374, ack 2576, win 501, length 1460
10:20:06.902113 IP felstaube.cs.sbg.ac.at.ssh > 192.168.0.58.34888: Flags [.], seq 116374:117834, ack 2576, win 501, length 1460
10:20:06.902222 IP felstaube.cs.sbg.ac.at.ssh > 192.168.0.58.34888: Flags [.], seq 117834:119294, ack 2576, win 501, length 1460
10:20:06.902389 IP felstaube.cs.sbg.ac.at.ssh > 192.168.0.58.34888: Flags [.], seq 119294:120754, ack 2576, win 501, length 1460
10:20:06.902458 IP felstaube.cs.sbg.ac.at.ssh > 192.168.0.58.34888: Flags [.], seq 120754:122214, ack 2576, win 501, length 1460
10:20:06.904245 IP felstaube.cs.sbg.ac.at.ssh > 192.168.0.58.34888: Flags [.], seq 122214:123674, ack 2576, win 501, length 1460
10:20:06.904346 IP felstaube.cs.sbg.ac.at.ssh > 192.168.0.58.34888: Flags [.], seq 123674:125134, ack 2576, win 501, length 1460
10:20:06.904512 IP felstaube.cs.sbg.ac.at.ssh > 192.168.0.58.34888: Flags [.], seq 125134:126594, ack 2576, win 501, length 1460
10:20:06.904578 IP felstaube.cs.sbg.ac.at.ssh > 192.168.0.58.34888: Flags [.], seq 126594:128054, ack 2576, win 501, length 1460
10:20:06.907160 IP felstaube.cs.sbg.ac.at.ssh > 192.168.0.58.34888: Flags [.], seq 128054:129514, ack 2576, win 501, length 1460
10:20:06.907271 IP felstaube.cs.sbg.ac.at.ssh > 192.168.0.58.34888: Flags [.], seq 129514:130974, ack 2576, win 501, length 1460
10:20:06.907441 IP felstaube.cs.sbg.ac.at.ssh > 192.168.0.58.34888: Flags [.], seq 130974:132434, ack 2576, win 501, length 1460
10:20:06.907506 IP felstaube.cs.sbg.ac.at.ssh > 192.168.0.58.34888: Flags [.], seq 132434:133894, ack 2576, win 501, length 1460
10:20:06.908603 IP felstaube.cs.sbg.ac.at.ssh > 192.168.0.58.34888: Flags [.], seq 133894:135354, ack 2576, win 501, length 1460
10:20:06.908742 IP felstaube.cs.sbg.ac.at.ssh > 192.168.0.58.34888: Flags [P.], seq 135354:136814, ack 2576, win 501, length 1460
10:20:06.908909 IP felstaube.cs.sbg.ac.at.ssh > 192.168.0.58.34888: Flags [.], seq 136814:138274, ack 2576, win 501, length 1460
10:20:06.908976 IP felstaube.cs.sbg.ac.at.ssh > 192.168.0.58.34888: Flags [.], seq 138274:139734, ack 2576, win 501, length 1460
10:20:06.910339 IP felstaube.cs.sbg.ac.at.ssh > 192.168.0.58.34888: Flags [.], seq 139734:141194, ack 2576, win 501, length 1460
10:20:06.910439 IP felstaube.cs.sbg.ac.at.ssh > 192.168.0.58.34888: Flags [.], seq 141194:142654, ack 2576, win 501, length 1460
10:20:06.910602 IP felstaube.cs.sbg.ac.at.ssh > 192.168.0.58.34888: Flags [.], seq 142654:144114, ack 2576, win 501, length 1460
10:20:06.910667 IP felstaube.cs.sbg.ac.at.ssh > 192.168.0.58.34888: Flags [.], seq 144114:145574, ack 2576, win 501, length 1460
10:20:06.910790 IP felstaube.cs.sbg.ac.at.ssh > 192.168.0.58.34888: Flags [.], seq 145574:147034, ack 2576, win 501, length 1460
10:20:06.912118 IP felstaube.cs.sbg.ac.at.ssh > 192.168.0.58.34888: Flags [.], seq 147034:148494, ack 2576, win 501, length 1460
10:20:06.912338 IP felstaube.cs.sbg.ac.at.ssh > 192.168.0.58.34888: Flags [.], seq 148494:149954, ack 2576, win 501, length 1460
10:20:06.912407 IP felstaube.cs.sbg.ac.at.ssh > 192.168.0.58.34888: Flags [.], seq 149954:151414, ack 2576, win 501, length 1460
10:20:06.912554 IP felstaube.cs.sbg.ac.at.ssh > 192.168.0.58.34888: Flags [.], seq 151414:152874, ack 2576, win 501, length 1460
10:20:06.913633 IP felstaube.cs.sbg.ac.at.ssh > 192.168.0.58.34888: Flags [.], seq 152874:154334, ack 2576, win 501, length 1460
10:20:06.913832 IP felstaube.cs.sbg.ac.at.ssh > 192.168.0.58.34888: Flags [.], seq 154334:155794, ack 2576, win 501, length 1460
10:20:06.913900 IP felstaube.cs.sbg.ac.at.ssh > 192.168.0.58.34888: Flags [.], seq 155794:157254, ack 2576, win 501, length 1460
10:20:06.914023 IP felstaube.cs.sbg.ac.at.ssh > 192.168.0.58.34888: Flags [.], seq 157254:158714, ack 2576, win 501, length 1460
10:20:06.917095 IP felstaube.cs.sbg.ac.at.ssh > 192.168.0.58.34888: Flags [.], seq 158714:160174, ack 2576, win 501, length 1460
10:20:06.917305 IP felstaube.cs.sbg.ac.at.ssh > 192.168.0.58.34888: Flags [.], seq 160174:161634, ack 2576, win 501, length 1460
10:20:06.917379 IP felstaube.cs.sbg.ac.at.ssh > 192.168.0.58.34888: Flags [.], seq 161634:163094, ack 2576, win 501, length 1460
10:20:06.917504 IP felstaube.cs.sbg.ac.at.ssh > 192.168.0.58.34888: Flags [.], seq 163094:164554, ack 2576, win 501, length 1460
10:20:06.918693 IP felstaube.cs.sbg.ac.at.ssh > 192.168.0.58.34888: Flags [.], seq 164554:166014, ack 2576, win 501, length 1460
10:20:06.918891 IP felstaube.cs.sbg.ac.at.ssh > 192.168.0.58.34888: Flags [.], seq 166014:167474, ack 2576, win 501, length 1460
10:20:06.918959 IP felstaube.cs.sbg.ac.at.ssh > 192.168.0.58.34888: Flags [.], seq 167474:168934, ack 2576, win 501, length 1460
10:20:06.919078 IP felstaube.cs.sbg.ac.at.ssh > 192.168.0.58.34888: Flags [.], seq 168934:170394, ack 2576, win 501, length 1460
10:20:06.919142 IP felstaube.cs.sbg.ac.at.ssh > 192.168.0.58.34888: Flags [.], seq 170394:171854, ack 2576, win 501, length 1460
10:20:06.922759 IP felstaube.cs.sbg.ac.at.ssh > 192.168.0.58.34888: Flags [.], seq 171854:173314, ack 2576, win 501, length 1460
10:20:06.922878 IP felstaube.cs.sbg.ac.at.ssh > 192.168.0.58.34888: Flags [.], seq 173314:174774, ack 2576, win 501, length 1460
10:20:06.923048 IP felstaube.cs.sbg.ac.at.ssh > 192.168.0.58.34888: Flags [.], seq 174774:176234, ack 2576, win 501, length 1460
10:20:06.924002 IP felstaube.cs.sbg.ac.at.ssh > 192.168.0.58.34888: Flags [.], seq 176234:177694, ack 2576, win 501, length 1460
10:20:06.924211 IP felstaube.cs.sbg.ac.at.ssh > 192.168.0.58.34888: Flags [.], seq 177694:179154, ack 2576, win 501, length 1460
10:20:06.924278 IP felstaube.cs.sbg.ac.at.ssh > 192.168.0.58.34888: Flags [.], seq 179154:180614, ack 2576, win 501, length 1460
10:20:06.924398 IP felstaube.cs.sbg.ac.at.ssh > 192.168.0.58.34888: Flags [.], seq 180614:182074, ack 2576, win 501, length 1460
10:20:06.924462 IP felstaube.cs.sbg.ac.at.ssh > 192.168.0.58.34888: Flags [.], seq 182074:183534, ack 2576, win 501, length 1460
10:20:06.924920 IP felstaube.cs.sbg.ac.at.ssh > 192.168.0.58.34888: Flags [.], seq 183534:184994, ack 2576, win 501, length 1460
10:20:06.925453 IP felstaube.cs.sbg.ac.at.ssh > 192.168.0.58.34888: Flags [.], seq 184994:186454, ack 2576, win 501, length 1460
10:20:06.925988 IP felstaube.cs.sbg.ac.at.ssh > 192.168.0.58.34888: Flags [.], seq 186454:187914, ack 2576, win 501, length 1460
10:20:06.926701 IP felstaube.cs.sbg.ac.at.ssh > 192.168.0.58.34888: Flags [.], seq 187914:189374, ack 2576, win 501, length 1460
10:20:06.927702 IP felstaube.cs.sbg.ac.at.ssh > 192.168.0.58.34888: Flags [.], seq 189374:190834, ack 2576, win 501, length 1460
10:20:06.927845 IP felstaube.cs.sbg.ac.at.ssh > 192.168.0.58.34888: Flags [.], seq 190834:192294, ack 2576, win 501, length 1460
10:20:06.928012 IP felstaube.cs.sbg.ac.at.ssh > 192.168.0.58.34888: Flags [.], seq 192294:193754, ack 2576, win 501, length 1460
10:20:06.928078 IP felstaube.cs.sbg.ac.at.ssh > 192.168.0.58.34888: Flags [.], seq 193754:195214, ack 2576, win 501, length 1460
10:20:06.928197 IP felstaube.cs.sbg.ac.at.ssh > 192.168.0.58.34888: Flags [.], seq 195214:196674, ack 2576, win 501, length 1460
10:20:06.930855 IP felstaube.cs.sbg.ac.at.ssh > 192.168.0.58.34888: Flags [.], seq 196674:198134, ack 2576, win 501, length 1460
10:20:06.931080 IP felstaube.cs.sbg.ac.at.ssh > 192.168.0.58.34888: Flags [.], seq 198134:199594, ack 2576, win 501, length 1460
10:20:06.931177 IP felstaube.cs.sbg.ac.at.ssh > 192.168.0.58.34888: Flags [.], seq 199594:201054, ack 2576, win 501, length 1460
10:20:06.931308 IP felstaube.cs.sbg.ac.at.ssh > 192.168.0.58.34888: Flags [.], seq 201054:202514, ack 2576, win 501, length 1460
10:20:06.932107 IP felstaube.cs.sbg.ac.at.ssh > 192.168.0.58.34888: Flags [.], seq 202514:203814, ack 2576, win 501, length 1300
10:20:06.932301 IP felstaube.cs.sbg.ac.at.ssh > 192.168.0.58.34888: Flags [.], seq 203814:205274, ack 2576, win 501, length 1460
10:20:06.932388 IP felstaube.cs.sbg.ac.at.ssh > 192.168.0.58.34888: Flags [.], seq 205274:206734, ack 2576, win 501, length 1460
10:20:06.932517 IP felstaube.cs.sbg.ac.at.ssh > 192.168.0.58.34888: Flags [.], seq 206734:208194, ack 2576, win 501, length 1460
10:20:06.933394 IP felstaube.cs.sbg.ac.at.ssh > 192.168.0.58.34888: Flags [.], seq 208194:209654, ack 2576, win 501, length 1460
10:20:06.933872 IP felstaube.cs.sbg.ac.at.ssh > 192.168.0.58.34888: Flags [.], seq 209654:211114, ack 2576, win 501, length 1460
10:20:06.936486 IP felstaube.cs.sbg.ac.at.ssh > 192.168.0.58.34888: Flags [.], seq 211114:212574, ack 2576, win 501, length 1460
10:20:06.937015 IP felstaube.cs.sbg.ac.at.ssh > 192.168.0.58.34888: Flags [.], seq 212574:214034, ack 2576, win 501, length 1460
10:20:06.937405 IP felstaube.cs.sbg.ac.at.ssh > 192.168.0.58.34888: Flags [.], seq 214034:215494, ack 2576, win 501, length 1460
10:20:06.938281 IP felstaube.cs.sbg.ac.at.ssh > 192.168.0.58.34888: Flags [.], seq 215494:216954, ack 2576, win 501, length 1460
10:20:06.938380 IP felstaube.cs.sbg.ac.at.ssh > 192.168.0.58.34888: Flags [.], seq 216954:218414, ack 2576, win 501, length 1460
10:20:06.938543 IP felstaube.cs.sbg.ac.at.ssh > 192.168.0.58.34888: Flags [.], seq 218414:219874, ack 2576, win 501, length 1460
10:20:06.938614 IP felstaube.cs.sbg.ac.at.ssh > 192.168.0.58.34888: Flags [.], seq 219874:221334, ack 2576, win 501, length 1460
10:20:06.945756 IP felstaube.cs.sbg.ac.at.ssh > 192.168.0.58.34888: Flags [.], seq 221334:222794, ack 2612, win 501, length 1460
10:20:06.946516 IP felstaube.cs.sbg.ac.at.ssh > 192.168.0.58.34888: Flags [.], seq 222794:224254, ack 2612, win 501, length 1460
10:20:06.946589 IP felstaube.cs.sbg.ac.at.ssh > 192.168.0.58.34888: Flags [.], seq 224254:225714, ack 2612, win 501, length 1460
10:20:06.947661 IP felstaube.cs.sbg.ac.at.ssh > 192.168.0.58.34888: Flags [.], seq 225714:227174, ack 2612, win 501, length 1460
10:20:06.947752 IP felstaube.cs.sbg.ac.at.ssh > 192.168.0.58.34888: Flags [.], seq 227174:228634, ack 2612, win 501, length 1460
10:20:06.947891 IP felstaube.cs.sbg.ac.at.ssh > 192.168.0.58.34888: Flags [.], seq 228634:230094, ack 2612, win 501, length 1460
10:20:06.947956 IP felstaube.cs.sbg.ac.at.ssh > 192.168.0.58.34888: Flags [.], seq 230094:231554, ack 2612, win 501, length 1460
10:20:06.949445 IP felstaube.cs.sbg.ac.at.ssh > 192.168.0.58.34888: Flags [.], seq 231554:233014, ack 2612, win 501, length 1460
10:20:06.949549 IP felstaube.cs.sbg.ac.at.ssh > 192.168.0.58.34888: Flags [.], seq 233014:233174, ack 2612, win 501, length 160
10:20:06.949710 IP felstaube.cs.sbg.ac.at.ssh > 192.168.0.58.34888: Flags [.], seq 233174:234634, ack 2612, win 501, length 1460
10:20:06.949776 IP felstaube.cs.sbg.ac.at.ssh > 192.168.0.58.34888: Flags [.], seq 234634:236094, ack 2612, win 501, length 1460
10:20:06.949899 IP felstaube.cs.sbg.ac.at.ssh > 192.168.0.58.34888: Flags [.], seq 236094:237554, ack 2612, win 501, length 1460
10:20:06.949963 IP felstaube.cs.sbg.ac.at.ssh > 192.168.0.58.34888: Flags [.], seq 237554:239014, ack 2612, win 501, length 1460
10:20:06.951298 IP felstaube.cs.sbg.ac.at.ssh > 192.168.0.58.34888: Flags [.], seq 239014:240474, ack 2612, win 501, length 1460
10:20:06.951402 IP felstaube.cs.sbg.ac.at.ssh > 192.168.0.58.34888: Flags [.], seq 240474:241934, ack 2612, win 501, length 1460
10:20:06.951561 IP felstaube.cs.sbg.ac.at.ssh > 192.168.0.58.34888: Flags [.], seq 241934:243394, ack 2612, win 501, length 1460
10:20:06.957246 IP felstaube.cs.sbg.ac.at.ssh > 192.168.0.58.34888: Flags [.], seq 243394:244854, ack 2612, win 501, length 1460
10:20:06.957463 IP felstaube.cs.sbg.ac.at.ssh > 192.168.0.58.34888: Flags [.], seq 244854:246314, ack 2612, win 501, length 1460
10:20:06.957534 IP felstaube.cs.sbg.ac.at.ssh > 192.168.0.58.34888: Flags [.], seq 246314:247774, ack 2612, win 501, length 1460
10:20:06.957652 IP felstaube.cs.sbg.ac.at.ssh > 192.168.0.58.34888: Flags [.], seq 247774:249234, ack 2612, win 501, length 1460
10:20:06.957715 IP felstaube.cs.sbg.ac.at.ssh > 192.168.0.58.34888: Flags [.], seq 249234:250694, ack 2612, win 501, length 1460
10:20:06.958826 IP felstaube.cs.sbg.ac.at.ssh > 192.168.0.58.34888: Flags [.], seq 250694:252154, ack 2612, win 501, length 1460
10:20:06.958927 IP felstaube.cs.sbg.ac.at.ssh > 192.168.0.58.34888: Flags [.], seq 252154:253614, ack 2612, win 501, length 1460
10:20:06.959082 IP felstaube.cs.sbg.ac.at.ssh > 192.168.0.58.34888: Flags [.], seq 253614:255074, ack 2612, win 501, length 1460
10:20:06.959145 IP felstaube.cs.sbg.ac.at.ssh > 192.168.0.58.34888: Flags [.], seq 255074:256534, ack 2612, win 501, length 1460
10:20:06.963217 IP felstaube.cs.sbg.ac.at.ssh > 192.168.0.58.34888: Flags [.], seq 256534:257994, ack 2612, win 501, length 1460
10:20:06.966032 IP felstaube.cs.sbg.ac.at.ssh > 192.168.0.58.34888: Flags [.], seq 257994:259454, ack 2612, win 501, length 1460
10:20:06.966241 IP felstaube.cs.sbg.ac.at.ssh > 192.168.0.58.34888: Flags [.], seq 259454:260914, ack 2612, win 501, length 1460
10:20:06.967414 IP felstaube.cs.sbg.ac.at.ssh > 192.168.0.58.34888: Flags [.], seq 260914:262374, ack 2612, win 501, length 1460
10:20:06.967612 IP felstaube.cs.sbg.ac.at.ssh > 192.168.0.58.34888: Flags [.], seq 262374:263834, ack 2612, win 501, length 1460
10:20:06.967679 IP felstaube.cs.sbg.ac.at.ssh > 192.168.0.58.34888: Flags [.], seq 263834:265294, ack 2612, win 501, length 1460
10:20:06.967803 IP felstaube.cs.sbg.ac.at.ssh > 192.168.0.58.34888: Flags [.], seq 265294:266754, ack 2612, win 501, length 1460
10:20:06.967869 IP felstaube.cs.sbg.ac.at.ssh > 192.168.0.58.34888: Flags [.], seq 266754:268214, ack 2612, win 501, length 1460
10:20:06.969129 IP felstaube.cs.sbg.ac.at.ssh > 192.168.0.58.34888: Flags [.], seq 268214:269674, ack 2612, win 501, length 1460
10:20:06.969224 IP felstaube.cs.sbg.ac.at.ssh > 192.168.0.58.34888: Flags [.], seq 269674:271134, ack 2612, win 501, length 1460
10:20:06.969384 IP felstaube.cs.sbg.ac.at.ssh > 192.168.0.58.34888: Flags [.], seq 271134:272594, ack 2612, win 501, length 1460
10:20:06.969448 IP felstaube.cs.sbg.ac.at.ssh > 192.168.0.58.34888: Flags [.], seq 272594:274054, ack 2612, win 501, length 1460
10:20:06.969567 IP felstaube.cs.sbg.ac.at.ssh > 192.168.0.58.34888: Flags [.], seq 274054:275514, ack 2612, win 501, length 1460
10:20:06.969632 IP felstaube.cs.sbg.ac.at.ssh > 192.168.0.58.34888: Flags [.], seq 275514:276974, ack 2612, win 501, length 1460
10:20:06.976282 IP felstaube.cs.sbg.ac.at.ssh > 192.168.0.58.34888: Flags [.], seq 276974:278434, ack 2612, win 501, length 1460
10:20:06.977156 IP felstaube.cs.sbg.ac.at.ssh > 192.168.0.58.34888: Flags [.], seq 278434:279894, ack 2612, win 501, length 1460
10:20:06.980644 IP felstaube.cs.sbg.ac.at.ssh > 192.168.0.58.34888: Flags [.], seq 279894:281354, ack 2612, win 501, length 1460
10:20:06.980733 IP felstaube.cs.sbg.ac.at.ssh > 192.168.0.58.34888: Flags [.], seq 281354:282814, ack 2612, win 501, length 1460
10:20:06.980874 IP felstaube.cs.sbg.ac.at.ssh > 192.168.0.58.34888: Flags [.], seq 282814:284274, ack 2612, win 501, length 1460
10:20:06.980927 IP felstaube.cs.sbg.ac.at.ssh > 192.168.0.58.34888: Flags [.], seq 284274:285734, ack 2612, win 501, length 1460
10:20:06.981022 IP felstaube.cs.sbg.ac.at.ssh > 192.168.0.58.34888: Flags [.], seq 285734:287194, ack 2612, win 501, length 1460
10:20:06.981823 IP felstaube.cs.sbg.ac.at.ssh > 192.168.0.58.34888: Flags [.], seq 287194:288654, ack 2612, win 501, length 1460
10:20:06.981994 IP felstaube.cs.sbg.ac.at.ssh > 192.168.0.58.34888: Flags [.], seq 288654:290114, ack 2612, win 501, length 1460
10:20:06.982047 IP felstaube.cs.sbg.ac.at.ssh > 192.168.0.58.34888: Flags [.], seq 290114:291574, ack 2612, win 501, length 1460
10:20:06.982142 IP felstaube.cs.sbg.ac.at.ssh > 192.168.0.58.34888: Flags [.], seq 291574:293034, ack 2612, win 501, length 1460
10:20:06.982191 IP felstaube.cs.sbg.ac.at.ssh > 192.168.0.58.34888: Flags [.], seq 293034:294494, ack 2612, win 501, length 1460
10:20:06.982567 IP felstaube.cs.sbg.ac.at.ssh > 192.168.0.58.34888: Flags [.], seq 294494:295954, ack 2612, win 501, length 1460
10:20:06.983246 IP felstaube.cs.sbg.ac.at.ssh > 192.168.0.58.34888: Flags [.], seq 295954:297414, ack 2612, win 501, length 1460
10:20:06.983871 IP felstaube.cs.sbg.ac.at.ssh > 192.168.0.58.34888: Flags [.], seq 297414:298874, ack 2612, win 501, length 1460
10:20:06.984783 IP felstaube.cs.sbg.ac.at.ssh > 192.168.0.58.34888: Flags [.], seq 298874:300334, ack 2612, win 501, length 1460
10:20:06.984955 IP felstaube.cs.sbg.ac.at.ssh > 192.168.0.58.34888: Flags [.], seq 300334:301794, ack 2612, win 501, length 1460
10:20:06.985008 IP felstaube.cs.sbg.ac.at.ssh > 192.168.0.58.34888: Flags [.], seq 301794:303254, ack 2612, win 501, length 1460
10:20:06.985103 IP felstaube.cs.sbg.ac.at.ssh > 192.168.0.58.34888: Flags [.], seq 303254:304714, ack 2612, win 501, length 1460
10:20:06.985491 IP felstaube.cs.sbg.ac.at.ssh > 192.168.0.58.34888: Flags [.], seq 304714:306174, ack 2612, win 501, length 1460
10:20:06.986384 IP felstaube.cs.sbg.ac.at.ssh > 192.168.0.58.34888: Flags [.], seq 306174:307634, ack 2612, win 501, length 1460
10:20:06.987237 IP felstaube.cs.sbg.ac.at.ssh > 192.168.0.58.34888: Flags [.], seq 307634:309094, ack 2612, win 501, length 1460
10:20:06.987403 IP felstaube.cs.sbg.ac.at.ssh > 192.168.0.58.34888: Flags [.], seq 309094:310554, ack 2612, win 501, length 1460
10:20:06.987456 IP felstaube.cs.sbg.ac.at.ssh > 192.168.0.58.34888: Flags [.], seq 310554:312014, ack 2612, win 501, length 1460
10:20:06.987905 IP felstaube.cs.sbg.ac.at.ssh > 192.168.0.58.34888: Flags [.], seq 312014:313474, ack 2612, win 501, length 1460
10:20:06.988570 IP felstaube.cs.sbg.ac.at.ssh > 192.168.0.58.34888: Flags [.], seq 313474:314934, ack 2612, win 501, length 1460
10:20:06.989045 IP felstaube.cs.sbg.ac.at.ssh > 192.168.0.58.34888: Flags [.], seq 314934:316394, ack 2612, win 501, length 1460
10:20:06.989638 IP felstaube.cs.sbg.ac.at.ssh > 192.168.0.58.34888: Flags [.], seq 316394:317854, ack 2612, win 501, length 1460
10:20:06.990270 IP felstaube.cs.sbg.ac.at.ssh > 192.168.0.58.34888: Flags [.], seq 317854:319314, ack 2612, win 501, length 1460
10:20:06.990928 IP felstaube.cs.sbg.ac.at.ssh > 192.168.0.58.34888: Flags [.], seq 319314:320774, ack 2612, win 501, length 1460
10:20:06.995396 IP felstaube.cs.sbg.ac.at.ssh > 192.168.0.58.34888: Flags [.], seq 320774:322234, ack 2612, win 501, length 1460
10:20:06.995826 IP felstaube.cs.sbg.ac.at.ssh > 192.168.0.58.34888: Flags [.], seq 322234:323694, ack 2612, win 501, length 1460
10:20:06.996214 IP felstaube.cs.sbg.ac.at.ssh > 192.168.0.58.34888: Flags [.], seq 323694:325154, ack 2612, win 501, length 1460
10:20:06.996491 IP felstaube.cs.sbg.ac.at.ssh > 192.168.0.58.34888: Flags [.], seq 325154:326614, ack 2612, win 501, length 1460
10:20:06.996885 IP felstaube.cs.sbg.ac.at.ssh > 192.168.0.58.34888: Flags [.], seq 326614:328074, ack 2612, win 501, length 1460
10:20:06.997173 IP felstaube.cs.sbg.ac.at.ssh > 192.168.0.58.34888: Flags [.], seq 328074:329534, ack 2612, win 501, length 1460
10:20:06.997689 IP felstaube.cs.sbg.ac.at.ssh > 192.168.0.58.34888: Flags [.], seq 329534:330994, ack 2612, win 501, length 1460
10:20:06.998208 IP felstaube.cs.sbg.ac.at.ssh > 192.168.0.58.34888: Flags [.], seq 330994:332454, ack 2612, win 501, length 1460
10:20:06.998815 IP felstaube.cs.sbg.ac.at.ssh > 192.168.0.58.34888: Flags [.], seq 332454:333914, ack 2612, win 501, length 1460
10:20:06.999358 IP felstaube.cs.sbg.ac.at.ssh > 192.168.0.58.34888: Flags [.], seq 333914:335374, ack 2612, win 501, length 1460
10:20:06.999844 IP felstaube.cs.sbg.ac.at.ssh > 192.168.0.58.34888: Flags [.], seq 335374:336834, ack 2612, win 501, length 1460
10:20:07.000413 IP felstaube.cs.sbg.ac.at.ssh > 192.168.0.58.34888: Flags [.], seq 336834:338294, ack 2612, win 501, length 1460
10:20:07.001091 IP felstaube.cs.sbg.ac.at.ssh > 192.168.0.58.34888: Flags [.], seq 338294:339754, ack 2612, win 501, length 1460
10:20:07.002167 IP felstaube.cs.sbg.ac.at.ssh > 192.168.0.58.34888: Flags [.], seq 339754:341214, ack 2612, win 501, length 1460
10:20:07.002856 IP felstaube.cs.sbg.ac.at.ssh > 192.168.0.58.34888: Flags [.], seq 341214:342674, ack 2612, win 501, length 1460
10:20:07.003303 IP felstaube.cs.sbg.ac.at.ssh > 192.168.0.58.34888: Flags [.], seq 342674:344134, ack 2612, win 501, length 1460
10:20:07.003768 IP felstaube.cs.sbg.ac.at.ssh > 192.168.0.58.34888: Flags [.], seq 344134:345594, ack 2612, win 501, length 1460
10:20:07.004258 IP felstaube.cs.sbg.ac.at.ssh > 192.168.0.58.34888: Flags [.], seq 345594:347054, ack 2612, win 501, length 1460
10:20:07.004721 IP felstaube.cs.sbg.ac.at.ssh > 192.168.0.58.34888: Flags [.], seq 347054:348514, ack 2612, win 501, length 1460
10:20:07.008347 IP felstaube.cs.sbg.ac.at.ssh > 192.168.0.58.34888: Flags [.], seq 348514:349974, ack 2612, win 501, length 1460
10:20:07.009065 IP felstaube.cs.sbg.ac.at.ssh > 192.168.0.58.34888: Flags [.], seq 349974:351434, ack 2612, win 501, length 1460
10:20:07.009350 IP felstaube.cs.sbg.ac.at.ssh > 192.168.0.58.34888: Flags [.], seq 351434:352894, ack 2612, win 501, length 1460
10:20:07.009693 IP felstaube.cs.sbg.ac.at.ssh > 192.168.0.58.34888: Flags [.], seq 352894:354354, ack 2612, win 501, length 1460
10:20:07.009975 IP felstaube.cs.sbg.ac.at.ssh > 192.168.0.58.34888: Flags [.], seq 354354:355814, ack 2612, win 501, length 1460
10:20:07.010394 IP felstaube.cs.sbg.ac.at.ssh > 192.168.0.58.34888: Flags [.], seq 355814:357274, ack 2612, win 501, length 1460
10:20:07.010739 IP felstaube.cs.sbg.ac.at.ssh > 192.168.0.58.34888: Flags [.], seq 357274:358734, ack 2612, win 501, length 1460
10:20:07.011421 IP felstaube.cs.sbg.ac.at.ssh > 192.168.0.58.34888: Flags [.], seq 358734:360194, ack 2612, win 501, length 1460
10:20:07.011771 IP felstaube.cs.sbg.ac.at.ssh > 192.168.0.58.34888: Flags [.], seq 360194:361654, ack 2612, win 501, length 1460
10:20:07.012433 IP felstaube.cs.sbg.ac.at.ssh > 192.168.0.58.34888: Flags [.], seq 361654:363114, ack 2612, win 501, length 1460
10:20:07.012772 IP felstaube.cs.sbg.ac.at.ssh > 192.168.0.58.34888: Flags [.], seq 363114:364574, ack 2612, win 501, length 1460
10:20:07.013427 IP felstaube.cs.sbg.ac.at.ssh > 192.168.0.58.34888: Flags [.], seq 364574:366034, ack 2612, win 501, length 1460
10:20:07.013796 IP felstaube.cs.sbg.ac.at.ssh > 192.168.0.58.34888: Flags [.], seq 366034:367494, ack 2612, win 501, length 1460
10:20:07.014476 IP felstaube.cs.sbg.ac.at.ssh > 192.168.0.58.34888: Flags [.], seq 367494:368954, ack 2612, win 501, length 1460
10:20:07.015541 IP felstaube.cs.sbg.ac.at.ssh > 192.168.0.58.34888: Flags [.], seq 368954:370414, ack 2612, win 501, length 1460
10:20:07.016396 IP felstaube.cs.sbg.ac.at.ssh > 192.168.0.58.34888: Flags [.], seq 370414:371874, ack 2612, win 501, length 1460
10:20:07.016749 IP felstaube.cs.sbg.ac.at.ssh > 192.168.0.58.34888: Flags [.], seq 371874:373334, ack 2612, win 501, length 1460
10:20:07.017393 IP felstaube.cs.sbg.ac.at.ssh > 192.168.0.58.34888: Flags [.], seq 373334:374794, ack 2612, win 501, length 1460
10:20:07.017705 IP felstaube.cs.sbg.ac.at.ssh > 192.168.0.58.34888: Flags [.], seq 374794:376254, ack 2612, win 501, length 1460
10:20:07.018315 IP felstaube.cs.sbg.ac.at.ssh > 192.168.0.58.34888: Flags [.], seq 376254:377714, ack 2612, win 501, length 1460
10:20:07.021868 IP felstaube.cs.sbg.ac.at.ssh > 192.168.0.58.34888: Flags [.], seq 377714:379174, ack 2612, win 501, length 1460
10:20:07.022614 IP felstaube.cs.sbg.ac.at.ssh > 192.168.0.58.34888: Flags [.], seq 379174:380634, ack 2612, win 501, length 1460
10:20:07.022956 IP felstaube.cs.sbg.ac.at.ssh > 192.168.0.58.34888: Flags [.], seq 380634:382094, ack 2612, win 501, length 1460
10:20:07.023370 IP felstaube.cs.sbg.ac.at.ssh > 192.168.0.58.34888: Flags [.], seq 382094:383554, ack 2612, win 501, length 1460
10:20:07.023706 IP felstaube.cs.sbg.ac.at.ssh > 192.168.0.58.34888: Flags [.], seq 383554:385014, ack 2612, win 501, length 1460
10:20:07.024162 IP felstaube.cs.sbg.ac.at.ssh > 192.168.0.58.34888: Flags [.], seq 385014:386474, ack 2612, win 501, length 1460
10:20:07.024744 IP felstaube.cs.sbg.ac.at.ssh > 192.168.0.58.34888: Flags [.], seq 386474:387934, ack 2612, win 501, length 1460
10:20:07.025160 IP felstaube.cs.sbg.ac.at.ssh > 192.168.0.58.34888: Flags [.], seq 387934:389394, ack 2612, win 501, length 1460
10:20:07.025718 IP felstaube.cs.sbg.ac.at.ssh > 192.168.0.58.34888: Flags [.], seq 389394:390854, ack 2612, win 501, length 1460
10:20:07.026409 IP felstaube.cs.sbg.ac.at.ssh > 192.168.0.58.34888: Flags [.], seq 390854:392314, ack 2612, win 501, length 1460
10:20:07.026957 IP felstaube.cs.sbg.ac.at.ssh > 192.168.0.58.34888: Flags [.], seq 392314:393774, ack 2612, win 501, length 1460
10:20:07.027390 IP felstaube.cs.sbg.ac.at.ssh > 192.168.0.58.34888: Flags [.], seq 393774:395234, ack 2612, win 501, length 1460
10:20:07.027965 IP felstaube.cs.sbg.ac.at.ssh > 192.168.0.58.34888: Flags [.], seq 395234:396694, ack 2612, win 501, length 1460
10:20:07.028599 IP felstaube.cs.sbg.ac.at.ssh > 192.168.0.58.34888: Flags [.], seq 396694:398154, ack 2612, win 501, length 1460
10:20:07.029646 IP felstaube.cs.sbg.ac.at.ssh > 192.168.0.58.34888: Flags [.], seq 398154:399614, ack 2612, win 501, length 1460
10:20:07.030317 IP felstaube.cs.sbg.ac.at.ssh > 192.168.0.58.34888: Flags [.], seq 399614:401074, ack 2612, win 501, length 1460
10:20:07.030645 IP felstaube.cs.sbg.ac.at.ssh > 192.168.0.58.34888: Flags [.], seq 401074:402534, ack 2612, win 501, length 1460
10:20:07.031281 IP felstaube.cs.sbg.ac.at.ssh > 192.168.0.58.34888: Flags [.], seq 402534:403994, ack 2612, win 501, length 1460
10:20:07.034953 IP felstaube.cs.sbg.ac.at.ssh > 192.168.0.58.34888: Flags [.], seq 403994:405454, ack 2612, win 501, length 1460
10:20:07.035723 IP felstaube.cs.sbg.ac.at.ssh > 192.168.0.58.34888: Flags [.], seq 405454:406914, ack 2612, win 501, length 1460
10:20:07.036174 IP felstaube.cs.sbg.ac.at.ssh > 192.168.0.58.34888: Flags [.], seq 406914:408374, ack 2612, win 501, length 1460
10:20:07.036577 IP felstaube.cs.sbg.ac.at.ssh > 192.168.0.58.34888: Flags [.], seq 408374:409834, ack 2612, win 501, length 1460
10:20:07.036914 IP felstaube.cs.sbg.ac.at.ssh > 192.168.0.58.34888: Flags [.], seq 409834:411294, ack 2612, win 501, length 1460
10:20:07.037333 IP felstaube.cs.sbg.ac.at.ssh > 192.168.0.58.34888: Flags [.], seq 411294:412754, ack 2612, win 501, length 1460
10:20:07.037911 IP felstaube.cs.sbg.ac.at.ssh > 192.168.0.58.34888: Flags [.], seq 412754:414214, ack 2612, win 501, length 1460
10:20:07.038350 IP felstaube.cs.sbg.ac.at.ssh > 192.168.0.58.34888: Flags [.], seq 414214:415674, ack 2612, win 501, length 1460
10:20:07.038928 IP felstaube.cs.sbg.ac.at.ssh > 192.168.0.58.34888: Flags [.], seq 415674:417134, ack 2612, win 501, length 1460
10:20:07.039585 IP felstaube.cs.sbg.ac.at.ssh > 192.168.0.58.34888: Flags [.], seq 417134:418594, ack 2612, win 501, length 1460
10:20:07.039923 IP felstaube.cs.sbg.ac.at.ssh > 192.168.0.58.34888: Flags [.], seq 418594:420054, ack 2612, win 501, length 1460
10:20:07.040570 IP felstaube.cs.sbg.ac.at.ssh > 192.168.0.58.34888: Flags [.], seq 420054:421514, ack 2612, win 501, length 1460
10:20:07.041637 IP felstaube.cs.sbg.ac.at.ssh > 192.168.0.58.34888: Flags [.], seq 421514:422974, ack 2612, win 501, length 1460
10:20:07.042345 IP felstaube.cs.sbg.ac.at.ssh > 192.168.0.58.34888: Flags [.], seq 422974:424434, ack 2612, win 501, length 1460
10:20:07.042668 IP felstaube.cs.sbg.ac.at.ssh > 192.168.0.58.34888: Flags [.], seq 424434:425894, ack 2612, win 501, length 1460
10:20:07.043299 IP felstaube.cs.sbg.ac.at.ssh > 192.168.0.58.34888: Flags [.], seq 425894:427354, ack 2612, win 501, length 1460
10:20:07.043617 IP felstaube.cs.sbg.ac.at.ssh > 192.168.0.58.34888: Flags [.], seq 427354:428814, ack 2612, win 501, length 1460
