10:44:50.060453 IP felstaube.cs.sbg.ac.at.ssh > 192.168.0.58.35000: Flags [S.], seq 1888264099, ack 769900398, win 64240, options [mss 1460,nop,nop,sackOK,nop,wscale 7], length 0
10:44:50.085105 IP felstaube.cs.sbg.ac.at.ssh > 192.168.0.58.35000: Flags [.], ack 44, win 502, length 0
10:44:50.094315 IP felstaube.cs.sbg.ac.at.ssh > 192.168.0.58.35000: Flags [P.], seq 1:42, ack 44, win 502, length 41
10:44:50.117823 IP felstaube.cs.sbg.ac.at.ssh > 192.168.0.58.35000: Flags [P.], seq 42:1122, ack 44, win 502, length 1080
10:44:50.167801 IP felstaube.cs.sbg.ac.at.ssh > 192.168.0.58.35000: Flags [.], ack 1436, win 501, length 0
10:44:50.191000 IP felstaube.cs.sbg.ac.at.ssh > 192.168.0.58.35000: Flags [.], ack 1484, win 501, length 0
10:44:50.197722 IP felstaube.cs.sbg.ac.at.ssh > 192.168.0.58.35000: Flags [P.], seq 1122:1574, ack 1484, win 501, length 452
10:44:50.308644 IP felstaube.cs.sbg.ac.at.ssh > 192.168.0.58.35000: Flags [.], ack 1500, win 501, length 0
10:44:50.330205 IP felstaube.cs.sbg.ac.at.ssh > 192.168.0.58.35000: Flags [.], ack 1544, win 501, length 0
10:44:50.330425 IP felstaube.cs.sbg.ac.at.ssh > 192.168.0.58.35000: Flags [P.], seq 1574:1618, ack 1544, win 501, length 44
10:44:50.362524 IP felstaube.cs.sbg.ac.at.ssh > 192.168.0.58.35000: Flags [P.], seq 1618:1670, ack 1612, win 501, length 52
10:44:50.491930 IP felstaube.cs.sbg.ac.at.ssh > 192.168.0.58.35000: Flags [P.], seq 1670:1698, ack 2264, win 501, length 28
10:44:50.563647 IP felstaube.cs.sbg.ac.at.ssh > 192.168.0.58.35000: Flags [.], ack 2376, win 501, length 0
10:44:50.591314 IP felstaube.cs.sbg.ac.at.ssh > 192.168.0.58.35000: Flags [P.], seq 1698:2346, ack 2376, win 501, length 648
10:44:50.613984 IP felstaube.cs.sbg.ac.at.ssh > 192.168.0.58.35000: Flags [P.], seq 2346:2390, ack 2376, win 501, length 44
10:44:50.638194 IP felstaube.cs.sbg.ac.at.ssh > 192.168.0.58.35000: Flags [.], ack 2504, win 501, length 0
10:44:50.639291 IP felstaube.cs.sbg.ac.at.ssh > 192.168.0.58.35000: Flags [P.], seq 2390:2462, ack 2504, win 501, length 72
10:44:50.664603 IP felstaube.cs.sbg.ac.at.ssh > 192.168.0.58.35000: Flags [P.], seq 2462:2514, ack 2540, win 501, length 52
10:44:50.696213 IP felstaube.cs.sbg.ac.at.ssh > 192.168.0.58.35000: Flags [.], seq 2514:3974, ack 2576, win 501, length 1460
10:44:50.697615 IP felstaube.cs.sbg.ac.at.ssh > 192.168.0.58.35000: Flags [.], seq 3974:5434, ack 2576, win 501, length 1460
10:44:50.697797 IP felstaube.cs.sbg.ac.at.ssh > 192.168.0.58.35000: Flags [.], seq 5434:6894, ack 2576, win 501, length 1460
10:44:50.697858 IP felstaube.cs.sbg.ac.at.ssh > 192.168.0.58.35000: Flags [.], seq 6894:8354, ack 2576, win 501, length 1460
10:44:50.697920 IP felstaube.cs.sbg.ac.at.ssh > 192.168.0.58.35000: Flags [.], seq 8354:9814, ack 2576, win 501, length 1460
10:44:50.699669 IP felstaube.cs.sbg.ac.at.ssh > 192.168.0.58.35000: Flags [.], seq 9814:11274, ack 2576, win 501, length 1460
10:44:50.700344 IP felstaube.cs.sbg.ac.at.ssh > 192.168.0.58.35000: Flags [.], seq 11274:12734, ack 2576, win 501, length 1460
10:44:50.700526 IP felstaube.cs.sbg.ac.at.ssh > 192.168.0.58.35000: Flags [.], seq 12734:14194, ack 2576, win 501, length 1460
10:44:50.701729 IP felstaube.cs.sbg.ac.at.ssh > 192.168.0.58.35000: Flags [.], seq 14194:15654, ack 2576, win 501, length 1460
10:44:50.701907 IP felstaube.cs.sbg.ac.at.ssh > 192.168.0.58.35000: Flags [.], seq 15654:17114, ack 2576, win 501, length 1460
10:44:50.721867 IP felstaube.cs.sbg.ac.at.ssh > 192.168.0.58.35000: Flags [.], seq 17114:18574, ack 2576, win 501, length 1460
10:44:50.724413 IP felstaube.cs.sbg.ac.at.ssh > 192.168.0.58.35000: Flags [.], seq 18574:20034, ack 2576, win 501, length 1460
10:44:50.724508 IP felstaube.cs.sbg.ac.at.ssh > 192.168.0.58.35000: Flags [.], seq 20034:21494, ack 2576, win 501, length 1460
10:44:50.724566 IP felstaube.cs.sbg.ac.at.ssh > 192.168.0.58.35000: Flags [.], seq 21494:22954, ack 2576, win 501, length 1460
10:44:50.727916 IP felstaube.cs.sbg.ac.at.ssh > 192.168.0.58.35000: Flags [.], seq 22954:24414, ack 2576, win 501, length 1460
10:44:50.728855 IP felstaube.cs.sbg.ac.at.ssh > 192.168.0.58.35000: Flags [.], seq 24414:25874, ack 2576, win 501, length 1460
10:44:50.729019 IP felstaube.cs.sbg.ac.at.ssh > 192.168.0.58.35000: Flags [.], seq 25874:27334, ack 2576, win 501, length 1460
10:44:50.729080 IP felstaube.cs.sbg.ac.at.ssh > 192.168.0.58.35000: Flags [.], seq 27334:28794, ack 2576, win 501, length 1460
10:44:50.729129 IP felstaube.cs.sbg.ac.at.ssh > 192.168.0.58.35000: Flags [.], seq 28794:30254, ack 2576, win 501, length 1460
10:44:50.730222 IP felstaube.cs.sbg.ac.at.ssh > 192.168.0.58.35000: Flags [.], seq 30254:31714, ack 2576, win 501, length 1460
10:44:50.730311 IP felstaube.cs.sbg.ac.at.ssh > 192.168.0.58.35000: Flags [.], seq 31714:33174, ack 2576, win 501, length 1460
10:44:50.730369 IP felstaube.cs.sbg.ac.at.ssh > 192.168.0.58.35000: Flags [.], seq 33174:34634, ack 2576, win 501, length 1460
10:44:50.730419 IP felstaube.cs.sbg.ac.at.ssh > 192.168.0.58.35000: Flags [.], seq 34634:36094, ack 2576, win 501, length 1460
10:44:50.730468 IP felstaube.cs.sbg.ac.at.ssh > 192.168.0.58.35000: Flags [.], seq 36094:37554, ack 2576, win 501, length 1460
10:44:50.730516 IP felstaube.cs.sbg.ac.at.ssh > 192.168.0.58.35000: Flags [.], seq 37554:39014, ack 2576, win 501, length 1460
10:44:50.732641 IP felstaube.cs.sbg.ac.at.ssh > 192.168.0.58.35000: Flags [.], seq 39014:40474, ack 2576, win 501, length 1460
10:44:50.732742 IP felstaube.cs.sbg.ac.at.ssh > 192.168.0.58.35000: Flags [.], seq 40474:41934, ack 2576, win 501, length 1460
10:44:50.732791 IP felstaube.cs.sbg.ac.at.ssh > 192.168.0.58.35000: Flags [.], seq 41934:43394, ack 2576, win 501, length 1460
10:44:50.742851 IP felstaube.cs.sbg.ac.at.ssh > 192.168.0.58.35000: Flags [.], seq 43394:44854, ack 2576, win 501, length 1460
10:44:50.745058 IP felstaube.cs.sbg.ac.at.ssh > 192.168.0.58.35000: Flags [.], seq 44854:46314, ack 2576, win 501, length 1460
10:44:50.745238 IP felstaube.cs.sbg.ac.at.ssh > 192.168.0.58.35000: Flags [.], seq 46314:47774, ack 2576, win 501, length 1460
10:44:50.745300 IP felstaube.cs.sbg.ac.at.ssh > 192.168.0.58.35000: Flags [.], seq 47774:49234, ack 2576, win 501, length 1460
10:44:50.754368 IP felstaube.cs.sbg.ac.at.ssh > 192.168.0.58.35000: Flags [.], seq 49234:50694, ack 2576, win 501, length 1460
10:44:50.755567 IP felstaube.cs.sbg.ac.at.ssh > 192.168.0.58.35000: Flags [.], seq 50694:52154, ack 2576, win 501, length 1460
10:44:50.755818 IP felstaube.cs.sbg.ac.at.ssh > 192.168.0.58.35000: Flags [.], seq 52154:53614, ack 2576, win 501, length 1460
10:44:50.755953 IP felstaube.cs.sbg.ac.at.ssh > 192.168.0.58.35000: Flags [.], seq 53614:55074, ack 2576, win 501, length 1460
10:44:50.758816 IP felstaube.cs.sbg.ac.at.ssh > 192.168.0.58.35000: Flags [.], seq 55074:56534, ack 2576, win 501, length 1460
10:44:50.758897 IP felstaube.cs.sbg.ac.at.ssh > 192.168.0.58.35000: Flags [.], seq 56534:57994, ack 2576, win 501, length 1460
10:44:50.758952 IP felstaube.cs.sbg.ac.at.ssh > 192.168.0.58.35000: Flags [.], seq 57994:59454, ack 2576, win 501, length 1460
10:44:50.758997 IP felstaube.cs.sbg.ac.at.ssh > 192.168.0.58.35000: Flags [.], seq 59454:60914, ack 2576, win 501, length 1460
10:44:50.759700 IP felstaube.cs.sbg.ac.at.ssh > 192.168.0.58.35000: Flags [.], seq 60914:62374, ack 2576, win 501, length 1460
10:44:50.759783 IP felstaube.cs.sbg.ac.at.ssh > 192.168.0.58.35000: Flags [.], seq 62374:63834, ack 2576, win 501, length 1460
10:44:50.759832 IP felstaube.cs.sbg.ac.at.ssh > 192.168.0.58.35000: Flags [.], seq 63834:65294, ack 2576, win 501, length 1460
10:44:50.759880 IP felstaube.cs.sbg.ac.at.ssh > 192.168.0.58.35000: Flags [.], seq 65294:66754, ack 2576, win 501, length 1460
10:44:50.760985 IP felstaube.cs.sbg.ac.at.ssh > 192.168.0.58.35000: Flags [P.], seq 66754:68194, ack 2576, win 501, length 1440
10:44:50.761064 IP felstaube.cs.sbg.ac.at.ssh > 192.168.0.58.35000: Flags [.], seq 68194:69654, ack 2576, win 501, length 1460
10:44:50.761114 IP felstaube.cs.sbg.ac.at.ssh > 192.168.0.58.35000: Flags [.], seq 69654:71114, ack 2576, win 501, length 1460
10:44:50.761791 IP felstaube.cs.sbg.ac.at.ssh > 192.168.0.58.35000: Flags [.], seq 71114:72574, ack 2576, win 501, length 1460
10:44:50.762656 IP felstaube.cs.sbg.ac.at.ssh > 192.168.0.58.35000: Flags [.], seq 72574:74034, ack 2576, win 501, length 1460
10:44:50.762825 IP felstaube.cs.sbg.ac.at.ssh > 192.168.0.58.35000: Flags [.], seq 74034:75494, ack 2576, win 501, length 1460
10:44:50.762878 IP felstaube.cs.sbg.ac.at.ssh > 192.168.0.58.35000: Flags [.], seq 75494:76954, ack 2576, win 501, length 1460
10:44:50.762977 IP felstaube.cs.sbg.ac.at.ssh > 192.168.0.58.35000: Flags [.], seq 76954:78414, ack 2576, win 501, length 1460
10:44:50.763841 IP felstaube.cs.sbg.ac.at.ssh > 192.168.0.58.35000: Flags [.], seq 78414:79874, ack 2576, win 501, length 1460
10:44:50.763989 IP felstaube.cs.sbg.ac.at.ssh > 192.168.0.58.35000: Flags [.], seq 79874:81334, ack 2576, win 501, length 1460
10:44:50.764041 IP felstaube.cs.sbg.ac.at.ssh > 192.168.0.58.35000: Flags [.], seq 81334:82794, ack 2576, win 501, length 1460
10:44:50.764144 IP felstaube.cs.sbg.ac.at.ssh > 192.168.0.58.35000: Flags [.], seq 82794:84254, ack 2576, win 501, length 1460
10:44:50.765168 IP felstaube.cs.sbg.ac.at.ssh > 192.168.0.58.35000: Flags [.], seq 84254:85714, ack 2576, win 501, length 1460
10:44:50.765329 IP felstaube.cs.sbg.ac.at.ssh > 192.168.0.58.35000: Flags [.], seq 85714:87174, ack 2576, win 501, length 1460
10:44:50.765382 IP felstaube.cs.sbg.ac.at.ssh > 192.168.0.58.35000: Flags [.], seq 87174:88634, ack 2576, win 501, length 1460
10:44:50.765486 IP felstaube.cs.sbg.ac.at.ssh > 192.168.0.58.35000: Flags [.], seq 88634:90094, ack 2576, win 501, length 1460
10:44:50.765538 IP felstaube.cs.sbg.ac.at.ssh > 192.168.0.58.35000: Flags [.], seq 90094:91554, ack 2576, win 501, length 1460
10:44:50.765631 IP felstaube.cs.sbg.ac.at.ssh > 192.168.0.58.35000: Flags [.], seq 91554:93014, ack 2576, win 501, length 1460
10:44:50.767551 IP felstaube.cs.sbg.ac.at.ssh > 192.168.0.58.35000: Flags [.], seq 93014:94474, ack 2576, win 501, length 1460
10:44:50.770948 IP felstaube.cs.sbg.ac.at.ssh > 192.168.0.58.35000: Flags [.], seq 94474:95934, ack 2576, win 501, length 1460
10:44:50.771701 IP felstaube.cs.sbg.ac.at.ssh > 192.168.0.58.35000: Flags [.], seq 95934:97394, ack 2576, win 501, length 1460
10:44:50.771898 IP felstaube.cs.sbg.ac.at.ssh > 192.168.0.58.35000: Flags [.], seq 97394:98854, ack 2576, win 501, length 1460
10:44:50.771963 IP felstaube.cs.sbg.ac.at.ssh > 192.168.0.58.35000: Flags [.], seq 98854:100314, ack 2576, win 501, length 1460
10:44:50.793689 IP felstaube.cs.sbg.ac.at.ssh > 192.168.0.58.35000: Flags [.], seq 100314:101774, ack 2576, win 501, length 1460
10:44:50.796443 IP felstaube.cs.sbg.ac.at.ssh > 192.168.0.58.35000: Flags [P.], seq 101774:103234, ack 2576, win 501, length 1460
10:44:50.797416 IP felstaube.cs.sbg.ac.at.ssh > 192.168.0.58.35000: Flags [.], seq 103234:104694, ack 2576, win 501, length 1460
10:44:50.797521 IP felstaube.cs.sbg.ac.at.ssh > 192.168.0.58.35000: Flags [.], seq 104694:106154, ack 2576, win 501, length 1460
10:44:50.797672 IP felstaube.cs.sbg.ac.at.ssh > 192.168.0.58.35000: Flags [.], seq 106154:107614, ack 2576, win 501, length 1460
10:44:50.797735 IP felstaube.cs.sbg.ac.at.ssh > 192.168.0.58.35000: Flags [.], seq 107614:109074, ack 2576, win 501, length 1460
10:44:50.798790 IP felstaube.cs.sbg.ac.at.ssh > 192.168.0.58.35000: Flags [.], seq 109074:110534, ack 2576, win 501, length 1460
10:44:50.798888 IP felstaube.cs.sbg.ac.at.ssh > 192.168.0.58.35000: Flags [.], seq 110534:111994, ack 2576, win 501, length 1460
10:44:50.799048 IP felstaube.cs.sbg.ac.at.ssh > 192.168.0.58.35000: Flags [.], seq 111994:113454, ack 2576, win 501, length 1460
10:44:50.799112 IP felstaube.cs.sbg.ac.at.ssh > 192.168.0.58.35000: Flags [.], seq 113454:114914, ack 2576, win 501, length 1460
10:44:50.799229 IP felstaube.cs.sbg.ac.at.ssh > 192.168.0.58.35000: Flags [.], seq 114914:116374, ack 2576, win 501, length 1460
10:44:50.799293 IP felstaube.cs.sbg.ac.at.ssh > 192.168.0.58.35000: Flags [.], seq 116374:117834, ack 2576, win 501, length 1460
10:44:50.800440 IP felstaube.cs.sbg.ac.at.ssh > 192.168.0.58.35000: Flags [.], seq 117834:119294, ack 2576, win 501, length 1460
10:44:50.800518 IP felstaube.cs.sbg.ac.at.ssh > 192.168.0.58.35000: Flags [.], seq 119294:120754, ack 2576, win 501, length 1460
10:44:50.800576 IP felstaube.cs.sbg.ac.at.ssh > 192.168.0.58.35000: Flags [.], seq 120754:122214, ack 2576, win 501, length 1460
10:44:50.800626 IP felstaube.cs.sbg.ac.at.ssh > 192.168.0.58.35000: Flags [.], seq 122214:123674, ack 2576, win 501, length 1460
10:44:50.800675 IP felstaube.cs.sbg.ac.at.ssh > 192.168.0.58.35000: Flags [.], seq 123674:125134, ack 2576, win 501, length 1460
10:44:50.802027 IP felstaube.cs.sbg.ac.at.ssh > 192.168.0.58.35000: Flags [.], seq 125134:126594, ack 2576, win 501, length 1460
10:44:50.802122 IP felstaube.cs.sbg.ac.at.ssh > 192.168.0.58.35000: Flags [.], seq 126594:128054, ack 2576, win 501, length 1460
10:44:50.802269 IP felstaube.cs.sbg.ac.at.ssh > 192.168.0.58.35000: Flags [.], seq 128054:129514, ack 2576, win 501, length 1460
10:44:50.802331 IP felstaube.cs.sbg.ac.at.ssh > 192.168.0.58.35000: Flags [.], seq 129514:130974, ack 2576, win 501, length 1460
10:44:50.802446 IP felstaube.cs.sbg.ac.at.ssh > 192.168.0.58.35000: Flags [.], seq 130974:132434, ack 2576, win 501, length 1460
10:44:50.803652 IP felstaube.cs.sbg.ac.at.ssh > 192.168.0.58.35000: Flags [.], seq 132434:133894, ack 2576, win 501, length 1460
10:44:50.803753 IP felstaube.cs.sbg.ac.at.ssh > 192.168.0.58.35000: Flags [.], seq 133894:135354, ack 2576, win 501, length 1460
10:44:50.803902 IP felstaube.cs.sbg.ac.at.ssh > 192.168.0.58.35000: Flags [.], seq 135354:136814, ack 2576, win 501, length 1460
10:44:50.803965 IP felstaube.cs.sbg.ac.at.ssh > 192.168.0.58.35000: Flags [.], seq 136814:138274, ack 2576, win 501, length 1460
10:44:50.804085 IP felstaube.cs.sbg.ac.at.ssh > 192.168.0.58.35000: Flags [.], seq 138274:139734, ack 2576, win 501, length 1460
10:44:50.805204 IP felstaube.cs.sbg.ac.at.ssh > 192.168.0.58.35000: Flags [.], seq 139734:141194, ack 2576, win 501, length 1460
10:44:50.805409 IP felstaube.cs.sbg.ac.at.ssh > 192.168.0.58.35000: Flags [.], seq 141194:142654, ack 2576, win 501, length 1460
10:44:50.805476 IP felstaube.cs.sbg.ac.at.ssh > 192.168.0.58.35000: Flags [.], seq 142654:144114, ack 2576, win 501, length 1460
10:44:50.805605 IP felstaube.cs.sbg.ac.at.ssh > 192.168.0.58.35000: Flags [.], seq 144114:145574, ack 2576, win 501, length 1460
10:44:50.805668 IP felstaube.cs.sbg.ac.at.ssh > 192.168.0.58.35000: Flags [.], seq 145574:147034, ack 2576, win 501, length 1460
10:44:50.808565 IP felstaube.cs.sbg.ac.at.ssh > 192.168.0.58.35000: Flags [.], seq 147034:148494, ack 2576, win 501, length 1460
10:44:50.808680 IP felstaube.cs.sbg.ac.at.ssh > 192.168.0.58.35000: Flags [.], seq 148494:149954, ack 2576, win 501, length 1460
10:44:50.811397 IP felstaube.cs.sbg.ac.at.ssh > 192.168.0.58.35000: Flags [.], seq 149954:151414, ack 2576, win 501, length 1460
10:44:50.811509 IP felstaube.cs.sbg.ac.at.ssh > 192.168.0.58.35000: Flags [.], seq 151414:152874, ack 2576, win 501, length 1460
10:44:50.811679 IP felstaube.cs.sbg.ac.at.ssh > 192.168.0.58.35000: Flags [.], seq 152874:154334, ack 2576, win 501, length 1460
10:44:50.833968 IP felstaube.cs.sbg.ac.at.ssh > 192.168.0.58.35000: Flags [.], seq 154334:155794, ack 2576, win 501, length 1460
10:44:50.835691 IP felstaube.cs.sbg.ac.at.ssh > 192.168.0.58.35000: Flags [.], seq 155794:157254, ack 2576, win 501, length 1460
10:44:50.836001 IP felstaube.cs.sbg.ac.at.ssh > 192.168.0.58.35000: Flags [.], seq 157254:158714, ack 2576, win 501, length 1460
10:44:50.836175 IP felstaube.cs.sbg.ac.at.ssh > 192.168.0.58.35000: Flags [.], seq 158714:160174, ack 2576, win 501, length 1460
10:44:50.836229 IP felstaube.cs.sbg.ac.at.ssh > 192.168.0.58.35000: Flags [.], seq 160174:161634, ack 2576, win 501, length 1460
10:44:50.836329 IP felstaube.cs.sbg.ac.at.ssh > 192.168.0.58.35000: Flags [.], seq 161634:163094, ack 2576, win 501, length 1460
10:44:50.837885 IP felstaube.cs.sbg.ac.at.ssh > 192.168.0.58.35000: Flags [.], seq 163094:164554, ack 2576, win 501, length 1460
10:44:50.838099 IP felstaube.cs.sbg.ac.at.ssh > 192.168.0.58.35000: Flags [.], seq 164554:166014, ack 2576, win 501, length 1460
10:44:50.838177 IP felstaube.cs.sbg.ac.at.ssh > 192.168.0.58.35000: Flags [P.], seq 166014:167474, ack 2576, win 501, length 1460
10:44:50.838300 IP felstaube.cs.sbg.ac.at.ssh > 192.168.0.58.35000: Flags [.], seq 167474:168934, ack 2576, win 501, length 1460
10:44:50.838974 IP felstaube.cs.sbg.ac.at.ssh > 192.168.0.58.35000: Flags [.], seq 168934:170394, ack 2576, win 501, length 1460
10:44:50.840165 IP felstaube.cs.sbg.ac.at.ssh > 192.168.0.58.35000: Flags [.], seq 170394:171854, ack 2576, win 501, length 1460
10:44:50.840253 IP felstaube.cs.sbg.ac.at.ssh > 192.168.0.58.35000: Flags [.], seq 171854:173314, ack 2576, win 501, length 1460
10:44:50.840411 IP felstaube.cs.sbg.ac.at.ssh > 192.168.0.58.35000: Flags [.], seq 173314:174774, ack 2576, win 501, length 1460
10:44:50.840474 IP felstaube.cs.sbg.ac.at.ssh > 192.168.0.58.35000: Flags [.], seq 174774:176234, ack 2576, win 501, length 1460
10:44:50.840588 IP felstaube.cs.sbg.ac.at.ssh > 192.168.0.58.35000: Flags [.], seq 176234:177694, ack 2576, win 501, length 1460
10:44:50.843128 IP felstaube.cs.sbg.ac.at.ssh > 192.168.0.58.35000: Flags [.], seq 177694:179154, ack 2576, win 501, length 1460
10:44:50.843333 IP felstaube.cs.sbg.ac.at.ssh > 192.168.0.58.35000: Flags [.], seq 179154:180614, ack 2576, win 501, length 1460
10:44:50.843398 IP felstaube.cs.sbg.ac.at.ssh > 192.168.0.58.35000: Flags [.], seq 180614:182074, ack 2576, win 501, length 1460
10:44:50.843517 IP felstaube.cs.sbg.ac.at.ssh > 192.168.0.58.35000: Flags [.], seq 182074:183534, ack 2576, win 501, length 1460
10:44:50.843583 IP felstaube.cs.sbg.ac.at.ssh > 192.168.0.58.35000: Flags [.], seq 183534:184994, ack 2576, win 501, length 1460
10:44:50.843701 IP felstaube.cs.sbg.ac.at.ssh > 192.168.0.58.35000: Flags [.], seq 184994:186454, ack 2576, win 501, length 1460
10:44:50.844792 IP felstaube.cs.sbg.ac.at.ssh > 192.168.0.58.35000: Flags [.], seq 186454:187914, ack 2576, win 501, length 1460
10:44:50.844989 IP felstaube.cs.sbg.ac.at.ssh > 192.168.0.58.35000: Flags [.], seq 187914:189374, ack 2576, win 501, length 1460
10:44:50.845054 IP felstaube.cs.sbg.ac.at.ssh > 192.168.0.58.35000: Flags [.], seq 189374:190834, ack 2576, win 501, length 1460
10:44:50.845170 IP felstaube.cs.sbg.ac.at.ssh > 192.168.0.58.35000: Flags [.], seq 190834:192294, ack 2576, win 501, length 1460
10:44:50.846102 IP felstaube.cs.sbg.ac.at.ssh > 192.168.0.58.35000: Flags [.], seq 192294:193754, ack 2576, win 501, length 1460
10:44:50.846298 IP felstaube.cs.sbg.ac.at.ssh > 192.168.0.58.35000: Flags [.], seq 193754:195214, ack 2576, win 501, length 1460
10:44:50.846371 IP felstaube.cs.sbg.ac.at.ssh > 192.168.0.58.35000: Flags [.], seq 195214:196674, ack 2576, win 501, length 1460
10:44:50.846494 IP felstaube.cs.sbg.ac.at.ssh > 192.168.0.58.35000: Flags [.], seq 196674:198134, ack 2576, win 501, length 1460
10:44:50.846554 IP felstaube.cs.sbg.ac.at.ssh > 192.168.0.58.35000: Flags [.], seq 198134:199594, ack 2576, win 501, length 1460
10:44:50.846668 IP felstaube.cs.sbg.ac.at.ssh > 192.168.0.58.35000: Flags [.], seq 199594:201054, ack 2576, win 501, length 1460
10:44:50.849327 IP felstaube.cs.sbg.ac.at.ssh > 192.168.0.58.35000: Flags [.], seq 201054:202514, ack 2576, win 501, length 1460
10:44:50.849538 IP felstaube.cs.sbg.ac.at.ssh > 192.168.0.58.35000: Flags [.], seq 202514:203974, ack 2576, win 501, length 1460
10:44:50.849603 IP felstaube.cs.sbg.ac.at.ssh > 192.168.0.58.35000: Flags [.], seq 203974:205434, ack 2576, win 501, length 1460
10:44:50.849720 IP felstaube.cs.sbg.ac.at.ssh > 192.168.0.58.35000: Flags [.], seq 205434:206894, ack 2576, win 501, length 1460
10:44:50.850143 IP felstaube.cs.sbg.ac.at.ssh > 192.168.0.58.35000: Flags [.], seq 206894:208354, ack 2576, win 501, length 1460
10:44:50.855374 IP felstaube.cs.sbg.ac.at.ssh > 192.168.0.58.35000: Flags [.], seq 208354:209814, ack 2612, win 501, length 1460
10:44:50.856960 IP felstaube.cs.sbg.ac.at.ssh > 192.168.0.58.35000: Flags [.], seq 209814:211274, ack 2612, win 501, length 1460
10:44:50.858886 IP felstaube.cs.sbg.ac.at.ssh > 192.168.0.58.35000: Flags [.], seq 211274:212734, ack 2612, win 501, length 1460
10:44:50.861169 IP felstaube.cs.sbg.ac.at.ssh > 192.168.0.58.35000: Flags [.], seq 212734:214194, ack 2612, win 501, length 1460
10:44:50.861387 IP felstaube.cs.sbg.ac.at.ssh > 192.168.0.58.35000: Flags [.], seq 214194:215654, ack 2612, win 501, length 1460
10:44:50.861462 IP felstaube.cs.sbg.ac.at.ssh > 192.168.0.58.35000: Flags [.], seq 215654:217114, ack 2612, win 501, length 1460
10:44:50.870828 IP felstaube.cs.sbg.ac.at.ssh > 192.168.0.58.35000: Flags [.], seq 217114:218574, ack 2612, win 501, length 1460
10:44:50.872814 IP felstaube.cs.sbg.ac.at.ssh > 192.168.0.58.35000: Flags [.], seq 218574:220034, ack 2612, win 501, length 1460
10:44:50.872999 IP felstaube.cs.sbg.ac.at.ssh > 192.168.0.58.35000: Flags [.], seq 220034:221494, ack 2612, win 501, length 1460
10:44:50.873059 IP felstaube.cs.sbg.ac.at.ssh > 192.168.0.58.35000: Flags [.], seq 221494:222954, ack 2612, win 501, length 1460
10:44:50.873158 IP felstaube.cs.sbg.ac.at.ssh > 192.168.0.58.35000: Flags [.], seq 222954:224414, ack 2612, win 501, length 1460
10:44:50.873212 IP felstaube.cs.sbg.ac.at.ssh > 192.168.0.58.35000: Flags [.], seq 224414:225874, ack 2612, win 501, length 1460
10:44:50.873307 IP felstaube.cs.sbg.ac.at.ssh > 192.168.0.58.35000: Flags [.], seq 225874:227334, ack 2612, win 501, length 1460
10:44:50.874413 IP felstaube.cs.sbg.ac.at.ssh > 192.168.0.58.35000: Flags [.], seq 227334:228794, ack 2612, win 501, length 1460
10:44:50.874577 IP felstaube.cs.sbg.ac.at.ssh > 192.168.0.58.35000: Flags [.], seq 228794:230254, ack 2612, win 501, length 1460
10:44:50.874629 IP felstaube.cs.sbg.ac.at.ssh > 192.168.0.58.35000: Flags [P.], seq 230254:231714, ack 2612, win 501, length 1460
10:44:50.874760 IP felstaube.cs.sbg.ac.at.ssh > 192.168.0.58.35000: Flags [.], seq 231714:233174, ack 2612, win 501, length 1460
10:44:50.876047 IP felstaube.cs.sbg.ac.at.ssh > 192.168.0.58.35000: Flags [.], seq 233174:234634, ack 2612, win 501, length 1460
10:44:50.876211 IP felstaube.cs.sbg.ac.at.ssh > 192.168.0.58.35000: Flags [.], seq 234634:236094, ack 2612, win 501, length 1460
10:44:50.876272 IP felstaube.cs.sbg.ac.at.ssh > 192.168.0.58.35000: Flags [.], seq 236094:237554, ack 2612, win 501, length 1460
10:44:50.876370 IP felstaube.cs.sbg.ac.at.ssh > 192.168.0.58.35000: Flags [.], seq 237554:239014, ack 2612, win 501, length 1460
10:44:50.877137 IP felstaube.cs.sbg.ac.at.ssh > 192.168.0.58.35000: Flags [.], seq 239014:240474, ack 2612, win 501, length 1460
10:44:50.877293 IP felstaube.cs.sbg.ac.at.ssh > 192.168.0.58.35000: Flags [.], seq 240474:241934, ack 2612, win 501, length 1460
10:44:50.885439 IP felstaube.cs.sbg.ac.at.ssh > 192.168.0.58.35000: Flags [.], seq 241934:243394, ack 2612, win 501, length 1460
10:44:50.885616 IP felstaube.cs.sbg.ac.at.ssh > 192.168.0.58.35000: Flags [.], seq 243394:244854, ack 2612, win 501, length 1460
10:44:50.885669 IP felstaube.cs.sbg.ac.at.ssh > 192.168.0.58.35000: Flags [.], seq 244854:246314, ack 2612, win 501, length 1460
10:44:50.885833 IP felstaube.cs.sbg.ac.at.ssh > 192.168.0.58.35000: Flags [.], seq 246314:247774, ack 2612, win 501, length 1460
10:44:50.889478 IP felstaube.cs.sbg.ac.at.ssh > 192.168.0.58.35000: Flags [.], seq 247774:249234, ack 2612, win 501, length 1460
10:44:50.889670 IP felstaube.cs.sbg.ac.at.ssh > 192.168.0.58.35000: Flags [.], seq 249234:250694, ack 2612, win 501, length 1460
10:44:50.889723 IP felstaube.cs.sbg.ac.at.ssh > 192.168.0.58.35000: Flags [.], seq 250694:252154, ack 2612, win 501, length 1460
10:44:50.889819 IP felstaube.cs.sbg.ac.at.ssh > 192.168.0.58.35000: Flags [.], seq 252154:253614, ack 2612, win 501, length 1460
10:44:50.889868 IP felstaube.cs.sbg.ac.at.ssh > 192.168.0.58.35000: Flags [.], seq 253614:255074, ack 2612, win 501, length 1460
10:44:50.890790 IP felstaube.cs.sbg.ac.at.ssh > 192.168.0.58.35000: Flags [.], seq 255074:256534, ack 2612, win 501, length 1460
10:44:50.890872 IP felstaube.cs.sbg.ac.at.ssh > 192.168.0.58.35000: Flags [.], seq 256534:257994, ack 2612, win 501, length 1460
10:44:50.891004 IP felstaube.cs.sbg.ac.at.ssh > 192.168.0.58.35000: Flags [.], seq 257994:259454, ack 2612, win 501, length 1460
10:44:50.891055 IP felstaube.cs.sbg.ac.at.ssh > 192.168.0.58.35000: Flags [.], seq 259454:260914, ack 2612, win 501, length 1460
10:44:50.891147 IP felstaube.cs.sbg.ac.at.ssh > 192.168.0.58.35000: Flags [.], seq 260914:262374, ack 2612, win 501, length 1460
10:44:50.891197 IP felstaube.cs.sbg.ac.at.ssh > 192.168.0.58.35000: Flags [.], seq 262374:263834, ack 2612, win 501, length 1460
10:44:50.891936 IP felstaube.cs.sbg.ac.at.ssh > 192.168.0.58.35000: Flags [.], seq 263834:265294, ack 2612, win 501, length 1460
10:44:50.892019 IP felstaube.cs.sbg.ac.at.ssh > 192.168.0.58.35000: Flags [.], seq 265294:266754, ack 2612, win 501, length 1460
10:44:50.892145 IP felstaube.cs.sbg.ac.at.ssh > 192.168.0.58.35000: Flags [.], seq 266754:268214, ack 2612, win 501, length 1460
10:44:50.892195 IP felstaube.cs.sbg.ac.at.ssh > 192.168.0.58.35000: Flags [.], seq 268214:269674, ack 2612, win 501, length 1460
10:44:50.894190 IP felstaube.cs.sbg.ac.at.ssh > 192.168.0.58.35000: Flags [.], seq 269674:271134, ack 2612, win 501, length 1460
10:44:50.894277 IP felstaube.cs.sbg.ac.at.ssh > 192.168.0.58.35000: Flags [.], seq 271134:272594, ack 2612, win 501, length 1460
10:44:50.894816 IP felstaube.cs.sbg.ac.at.ssh > 192.168.0.58.35000: Flags [.], seq 272594:274054, ack 2612, win 501, length 1460
10:44:50.894887 IP felstaube.cs.sbg.ac.at.ssh > 192.168.0.58.35000: Flags [.], seq 274054:275514, ack 2612, win 501, length 1460
10:44:50.895258 IP felstaube.cs.sbg.ac.at.ssh > 192.168.0.58.35000: Flags [.], seq 275514:276974, ack 2612, win 501, length 1460
10:44:50.914330 IP felstaube.cs.sbg.ac.at.ssh > 192.168.0.58.35000: Flags [.], seq 276974:278434, ack 2612, win 501, length 1460
10:44:50.915589 IP felstaube.cs.sbg.ac.at.ssh > 192.168.0.58.35000: Flags [.], seq 278434:279894, ack 2612, win 501, length 1460
10:44:50.915683 IP felstaube.cs.sbg.ac.at.ssh > 192.168.0.58.35000: Flags [.], seq 279894:281354, ack 2612, win 501, length 1460
10:44:50.915916 IP felstaube.cs.sbg.ac.at.ssh > 192.168.0.58.35000: Flags [.], seq 281354:282814, ack 2612, win 501, length 1460
10:44:50.916760 IP felstaube.cs.sbg.ac.at.ssh > 192.168.0.58.35000: Flags [.], seq 282814:284274, ack 2612, win 501, length 1460
10:44:50.916920 IP felstaube.cs.sbg.ac.at.ssh > 192.168.0.58.35000: Flags [.], seq 284274:285734, ack 2612, win 501, length 1460
10:44:50.916979 IP felstaube.cs.sbg.ac.at.ssh > 192.168.0.58.35000: Flags [.], seq 285734:287194, ack 2612, win 501, length 1460
10:44:50.917078 IP felstaube.cs.sbg.ac.at.ssh > 192.168.0.58.35000: Flags [.], seq 287194:288654, ack 2612, win 501, length 1460
10:44:50.917132 IP felstaube.cs.sbg.ac.at.ssh > 192.168.0.58.35000: Flags [.], seq 288654:290114, ack 2612, win 501, length 1460
10:44:50.917227 IP felstaube.cs.sbg.ac.at.ssh > 192.168.0.58.35000: Flags [.], seq 290114:291574, ack 2612, win 501, length 1460
10:44:50.918016 IP felstaube.cs.sbg.ac.at.ssh > 192.168.0.58.35000: Flags [.], seq 291574:293034, ack 2612, win 501, length 1460
10:44:50.918170 IP felstaube.cs.sbg.ac.at.ssh > 192.168.0.58.35000: Flags [.], seq 293034:294494, ack 2612, win 501, length 1460
10:44:50.918227 IP felstaube.cs.sbg.ac.at.ssh > 192.168.0.58.35000: Flags [.], seq 294494:295954, ack 2612, win 501, length 1460
10:44:50.919348 IP felstaube.cs.sbg.ac.at.ssh > 192.168.0.58.35000: Flags [.], seq 295954:297414, ack 2612, win 501, length 1460
10:44:50.919434 IP felstaube.cs.sbg.ac.at.ssh > 192.168.0.58.35000: Flags [.], seq 297414:298874, ack 2612, win 501, length 1460
10:44:50.919567 IP felstaube.cs.sbg.ac.at.ssh > 192.168.0.58.35000: Flags [.], seq 298874:300334, ack 2612, win 501, length 1460
10:44:50.919623 IP felstaube.cs.sbg.ac.at.ssh > 192.168.0.58.35000: Flags [.], seq 300334:301794, ack 2612, win 501, length 1460
10:44:50.919773 IP felstaube.cs.sbg.ac.at.ssh > 192.168.0.58.35000: Flags [.], seq 301794:303254, ack 2612, win 501, length 1460
10:44:50.919829 IP felstaube.cs.sbg.ac.at.ssh > 192.168.0.58.35000: Flags [.], seq 303254:304714, ack 2612, win 501, length 1460
10:44:50.921078 IP felstaube.cs.sbg.ac.at.ssh > 192.168.0.58.35000: Flags [.], seq 304714:306174, ack 2612, win 501, length 1460
10:44:50.921163 IP felstaube.cs.sbg.ac.at.ssh > 192.168.0.58.35000: Flags [.], seq 306174:307634, ack 2612, win 501, length 1460
10:44:50.921294 IP felstaube.cs.sbg.ac.at.ssh > 192.168.0.58.35000: Flags [.], seq 307634:309094, ack 2612, win 501, length 1460
10:44:50.921346 IP felstaube.cs.sbg.ac.at.ssh > 192.168.0.58.35000: Flags [.], seq 309094:310554, ack 2612, win 501, length 1460
10:44:50.921438 IP felstaube.cs.sbg.ac.at.ssh > 192.168.0.58.35000: Flags [.], seq 310554:312014, ack 2612, win 501, length 1460
10:44:50.922311 IP felstaube.cs.sbg.ac.at.ssh > 192.168.0.58.35000: Flags [.], seq 312014:313474, ack 2612, win 501, length 1460
10:44:50.922454 IP felstaube.cs.sbg.ac.at.ssh > 192.168.0.58.35000: Flags [.], seq 313474:314934, ack 2612, win 501, length 1460
10:44:50.922506 IP felstaube.cs.sbg.ac.at.ssh > 192.168.0.58.35000: Flags [.], seq 314934:316394, ack 2612, win 501, length 1460
10:44:50.922596 IP felstaube.cs.sbg.ac.at.ssh > 192.168.0.58.35000: Flags [.], seq 316394:317854, ack 2612, win 501, length 1460
10:44:50.924165 IP felstaube.cs.sbg.ac.at.ssh > 192.168.0.58.35000: Flags [.], seq 317854:319314, ack 2612, win 501, length 1460
10:44:50.924319 IP felstaube.cs.sbg.ac.at.ssh > 192.168.0.58.35000: Flags [.], seq 319314:320774, ack 2612, win 501, length 1460
10:44:50.924370 IP felstaube.cs.sbg.ac.at.ssh > 192.168.0.58.35000: Flags [.], seq 320774:322234, ack 2612, win 501, length 1460
10:44:50.924465 IP felstaube.cs.sbg.ac.at.ssh > 192.168.0.58.35000: Flags [.], seq 322234:323694, ack 2612, win 501, length 1460
10:44:50.924513 IP felstaube.cs.sbg.ac.at.ssh > 192.168.0.58.35000: Flags [.], seq 323694:325154, ack 2612, win 501, length 1460
10:44:50.925981 IP felstaube.cs.sbg.ac.at.ssh > 192.168.0.58.35000: Flags [.], seq 325154:326614, ack 2612, win 501, length 1460
10:44:50.926070 IP felstaube.cs.sbg.ac.at.ssh > 192.168.0.58.35000: Flags [.], seq 326614:328074, ack 2612, win 501, length 1460
10:44:50.926205 IP felstaube.cs.sbg.ac.at.ssh > 192.168.0.58.35000: Flags [.], seq 328074:329534, ack 2612, win 501, length 1460
10:44:50.926256 IP felstaube.cs.sbg.ac.at.ssh > 192.168.0.58.35000: Flags [.], seq 329534:330994, ack 2612, win 501, length 1460
10:44:50.928305 IP felstaube.cs.sbg.ac.at.ssh > 192.168.0.58.35000: Flags [.], seq 330994:332454, ack 2612, win 501, length 1460
10:44:50.928396 IP felstaube.cs.sbg.ac.at.ssh > 192.168.0.58.35000: Flags [.], seq 332454:333914, ack 2612, win 501, length 1460
10:44:50.928538 IP felstaube.cs.sbg.ac.at.ssh > 192.168.0.58.35000: Flags [.], seq 333914:335374, ack 2612, win 501, length 1460
10:44:50.928590 IP felstaube.cs.sbg.ac.at.ssh > 192.168.0.58.35000: Flags [.], seq 335374:336834, ack 2612, win 501, length 1460
10:44:50.934789 IP felstaube.cs.sbg.ac.at.ssh > 192.168.0.58.35000: Flags [.], seq 336834:338294, ack 2648, win 501, length 1460
10:44:50.935195 IP felstaube.cs.sbg.ac.at.ssh > 192.168.0.58.35000: Flags [.], seq 338294:339754, ack 2648, win 501, length 1460
10:44:50.947054 IP felstaube.cs.sbg.ac.at.ssh > 192.168.0.58.35000: Flags [.], seq 339754:341214, ack 2648, win 501, length 1460
10:44:50.948454 IP felstaube.cs.sbg.ac.at.ssh > 192.168.0.58.35000: Flags [.], seq 341214:342674, ack 2648, win 501, length 1460
10:44:50.948629 IP felstaube.cs.sbg.ac.at.ssh > 192.168.0.58.35000: Flags [.], seq 342674:344134, ack 2648, win 501, length 1460
10:44:50.948690 IP felstaube.cs.sbg.ac.at.ssh > 192.168.0.58.35000: Flags [.], seq 344134:345594, ack 2648, win 501, length 1460
10:44:50.948790 IP felstaube.cs.sbg.ac.at.ssh > 192.168.0.58.35000: Flags [.], seq 345594:347054, ack 2648, win 501, length 1460
10:44:50.950270 IP felstaube.cs.sbg.ac.at.ssh > 192.168.0.58.35000: Flags [.], seq 347054:348514, ack 2648, win 501, length 1460
10:44:50.950437 IP felstaube.cs.sbg.ac.at.ssh > 192.168.0.58.35000: Flags [.], seq 348514:349974, ack 2648, win 501, length 1460
10:44:50.950497 IP felstaube.cs.sbg.ac.at.ssh > 192.168.0.58.35000: Flags [.], seq 349974:351434, ack 2648, win 501, length 1460
10:44:50.950594 IP felstaube.cs.sbg.ac.at.ssh > 192.168.0.58.35000: Flags [.], seq 351434:352894, ack 2648, win 501, length 1460
10:44:50.950650 IP felstaube.cs.sbg.ac.at.ssh > 192.168.0.58.35000: Flags [.], seq 352894:354354, ack 2648, win 501, length 1460
10:44:50.951367 IP felstaube.cs.sbg.ac.at.ssh > 192.168.0.58.35000: Flags [.], seq 354354:355814, ack 2648, win 501, length 1460
10:44:50.951455 IP felstaube.cs.sbg.ac.at.ssh > 192.168.0.58.35000: Flags [.], seq 355814:357274, ack 2648, win 501, length 1460
10:44:50.951592 IP felstaube.cs.sbg.ac.at.ssh > 192.168.0.58.35000: Flags [.], seq 357274:358734, ack 2648, win 501, length 1460
10:44:50.951647 IP felstaube.cs.sbg.ac.at.ssh > 192.168.0.58.35000: Flags [.], seq 358734:360194, ack 2648, win 501, length 1460
10:44:50.955158 IP felstaube.cs.sbg.ac.at.ssh > 192.168.0.58.35000: Flags [.], seq 360194:361654, ack 2648, win 501, length 1460
10:44:50.957167 IP felstaube.cs.sbg.ac.at.ssh > 192.168.0.58.35000: Flags [.], seq 361654:363114, ack 2648, win 501, length 1460
10:44:50.957332 IP felstaube.cs.sbg.ac.at.ssh > 192.168.0.58.35000: Flags [.], seq 363114:364574, ack 2648, win 501, length 1460
10:44:50.957396 IP felstaube.cs.sbg.ac.at.ssh > 192.168.0.58.35000: Flags [.], seq 364574:366034, ack 2648, win 501, length 1460
10:44:50.961101 IP felstaube.cs.sbg.ac.at.ssh > 192.168.0.58.35000: Flags [.], seq 366034:367494, ack 2648, win 501, length 1460
10:44:50.961186 IP felstaube.cs.sbg.ac.at.ssh > 192.168.0.58.35000: Flags [.], seq 367494:368954, ack 2648, win 501, length 1460
10:44:50.962343 IP felstaube.cs.sbg.ac.at.ssh > 192.168.0.58.35000: Flags [.], seq 368954:370414, ack 2648, win 501, length 1460
10:44:50.962429 IP felstaube.cs.sbg.ac.at.ssh > 192.168.0.58.35000: Flags [.], seq 370414:371874, ack 2648, win 501, length 1460
10:44:50.962560 IP felstaube.cs.sbg.ac.at.ssh > 192.168.0.58.35000: Flags [.], seq 371874:373334, ack 2648, win 501, length 1460
10:44:50.962611 IP felstaube.cs.sbg.ac.at.ssh > 192.168.0.58.35000: Flags [.], seq 373334:374794, ack 2648, win 501, length 1460
10:44:50.962706 IP felstaube.cs.sbg.ac.at.ssh > 192.168.0.58.35000: Flags [.], seq 374794:376254, ack 2648, win 501, length 1460
10:44:50.963625 IP felstaube.cs.sbg.ac.at.ssh > 192.168.0.58.35000: Flags [.], seq 376254:377714, ack 2648, win 501, length 1460
10:44:50.963786 IP felstaube.cs.sbg.ac.at.ssh > 192.168.0.58.35000: Flags [.], seq 377714:379174, ack 2648, win 501, length 1460
10:44:50.963838 IP felstaube.cs.sbg.ac.at.ssh > 192.168.0.58.35000: Flags [.], seq 379174:380634, ack 2648, win 501, length 1460
10:44:50.963937 IP felstaube.cs.sbg.ac.at.ssh > 192.168.0.58.35000: Flags [.], seq 380634:382094, ack 2648, win 501, length 1460
10:44:50.965137 IP felstaube.cs.sbg.ac.at.ssh > 192.168.0.58.35000: Flags [.], seq 382094:383554, ack 2648, win 501, length 1460
10:44:50.965231 IP felstaube.cs.sbg.ac.at.ssh > 192.168.0.58.35000: Flags [.], seq 383554:385014, ack 2648, win 501, length 1460
10:44:50.965364 IP felstaube.cs.sbg.ac.at.ssh > 192.168.0.58.35000: Flags [.], seq 385014:386474, ack 2648, win 501, length 1460
10:44:50.965419 IP felstaube.cs.sbg.ac.at.ssh > 192.168.0.58.35000: Flags [.], seq 386474:387934, ack 2648, win 501, length 1460
10:44:50.966310 IP felstaube.cs.sbg.ac.at.ssh > 192.168.0.58.35000: Flags [.], seq 387934:389394, ack 2648, win 501, length 1460
10:44:50.966401 IP felstaube.cs.sbg.ac.at.ssh > 192.168.0.58.35000: Flags [.], seq 389394:390854, ack 2648, win 501, length 1460
10:44:50.966539 IP felstaube.cs.sbg.ac.at.ssh > 192.168.0.58.35000: Flags [.], seq 390854:392314, ack 2648, win 501, length 1460
10:44:50.966596 IP felstaube.cs.sbg.ac.at.ssh > 192.168.0.58.35000: Flags [.], seq 392314:393774, ack 2648, win 501, length 1460
10:44:50.966696 IP felstaube.cs.sbg.ac.at.ssh > 192.168.0.58.35000: Flags [.], seq 393774:395234, ack 2648, win 501, length 1460
10:44:50.966749 IP felstaube.cs.sbg.ac.at.ssh > 192.168.0.58.35000: Flags [.], seq 395234:396694, ack 2648, win 501, length 1460
10:44:50.970363 IP felstaube.cs.sbg.ac.at.ssh > 192.168.0.58.35000: Flags [.], seq 396694:398154, ack 2648, win 501, length 1460
10:44:50.970452 IP felstaube.cs.sbg.ac.at.ssh > 192.168.0.58.35000: Flags [.], seq 398154:399614, ack 2648, win 501, length 1460
10:44:50.970603 IP felstaube.cs.sbg.ac.at.ssh > 192.168.0.58.35000: Flags [.], seq 399614:401074, ack 2648, win 501, length 1460
10:44:50.970655 IP felstaube.cs.sbg.ac.at.ssh > 192.168.0.58.35000: Flags [.], seq 401074:402534, ack 2648, win 501, length 1460
10:44:50.970769 IP felstaube.cs.sbg.ac.at.ssh > 192.168.0.58.35000: Flags [.], seq 402534:403994, ack 2648, win 501, length 1460
10:44:50.971127 IP felstaube.cs.sbg.ac.at.ssh > 192.168.0.58.35000: Flags [.], seq 403994:405454, ack 2648, win 501, length 1460
10:44:50.972865 IP felstaube.cs.sbg.ac.at.ssh > 192.168.0.58.35000: Flags [.], seq 405454:406914, ack 2648, win 501, length 1460
10:44:50.973402 IP felstaube.cs.sbg.ac.at.ssh > 192.168.0.58.35000: Flags [.], seq 406914:408374, ack 2648, win 501, length 1460
10:44:50.973572 IP felstaube.cs.sbg.ac.at.ssh > 192.168.0.58.35000: Flags [.], seq 408374:409834, ack 2648, win 501, length 1460
10:44:50.974081 IP felstaube.cs.sbg.ac.at.ssh > 192.168.0.58.35000: Flags [.], seq 409834:411294, ack 2648, win 501, length 1460
10:44:50.975443 IP felstaube.cs.sbg.ac.at.ssh > 192.168.0.58.35000: Flags [.], seq 411294:412754, ack 2648, win 501, length 1460
10:44:50.975517 IP felstaube.cs.sbg.ac.at.ssh > 192.168.0.58.35000: Flags [.], seq 412754:414214, ack 2648, win 501, length 1460
10:44:50.975668 IP felstaube.cs.sbg.ac.at.ssh > 192.168.0.58.35000: Flags [.], seq 414214:415674, ack 2648, win 501, length 1460
10:44:50.976297 IP felstaube.cs.sbg.ac.at.ssh > 192.168.0.58.35000: Flags [.], seq 415674:417134, ack 2648, win 501, length 1460
10:44:50.977804 IP felstaube.cs.sbg.ac.at.ssh > 192.168.0.58.35000: Flags [.], seq 417134:418594, ack 2648, win 501, length 1460
10:44:50.977897 IP felstaube.cs.sbg.ac.at.ssh > 192.168.0.58.35000: Flags [.], seq 418594:420054, ack 2648, win 501, length 1460
10:44:50.978030 IP felstaube.cs.sbg.ac.at.ssh > 192.168.0.58.35000: Flags [.], seq 420054:421514, ack 2648, win 501, length 1460
10:44:50.978085 IP felstaube.cs.sbg.ac.at.ssh > 192.168.0.58.35000: Flags [.], seq 421514:422974, ack 2648, win 501, length 1460
10:44:50.978181 IP felstaube.cs.sbg.ac.at.ssh > 192.168.0.58.35000: Flags [.], seq 422974:424434, ack 2648, win 501, length 1460
10:44:50.978234 IP felstaube.cs.sbg.ac.at.ssh > 192.168.0.58.35000: Flags [.], seq 424434:425894, ack 2648, win 501, length 1460
10:44:50.978330 IP felstaube.cs.sbg.ac.at.ssh > 192.168.0.58.35000: Flags [.], seq 425894:427354, ack 2648, win 501, length 1460
10:44:50.994814 IP felstaube.cs.sbg.ac.at.ssh > 192.168.0.58.35000: Flags [.], seq 427354:428814, ack 2648, win 501, length 1460
10:44:50.996700 IP felstaube.cs.sbg.ac.at.ssh > 192.168.0.58.35000: Flags [.], seq 428814:430274, ack 2648, win 501, length 1460
10:44:50.996790 IP felstaube.cs.sbg.ac.at.ssh > 192.168.0.58.35000: Flags [.], seq 430274:431734, ack 2648, win 501, length 1460
